Title,URL,Score,Upvote_Ratio,Num_Comments,Post_Date,target,source_model
Protests break out in major cities over new tax law.,https://www.reddit.com/r/politics/comments/post_123,666,0.9,4646,03-27-2026,1,gemini
ABC pulls Taylor Frankie Paul's season of 'Bachelorette' amid fallout over domestic abuse allegations,https://www.nbcnews.com/pop-culture/pop-culture-news/bachelorette-canceled-taylor-frankie-paul-season-abc-alleged-abuse-rcna264089,6345,0.96,666,2026-03-19,0,human
Researchers uncover unusual pattern in Arctic sea ice melt,https://www.apnews.com/article/arctic-sea-ice-melt-pattern-2026,3960,0.73,1497,2026-04-02,1,chatgpt
Heavy metal memorabilia on offer at Julien's 'Music Icons' auction [explainer],https://www.reuters.com/business/media-telecom/heavy-metal-memorabilia-offer-juliens-music-icons-auction-2026-03-24/,2475,0.82,238,2026-03-19,1,chatgpt
Rays RHP Ryan Pepiot (hip) to begin season on IL — update,https://www.reuters.com/sports/rays-rhp-ryan-pepiot-hip-begin-season-il--flm-2026-03-24/,2457,0.72,148,2026-03-15,1,chatgpt
"Arizona files criminal charges against Kalshi, accusing prediction market of illegal gambling",https://www.nbcnews.com/news/us-news/arizona-files-criminal-charges-kalshi-accusing-prediction-market-illeg-rcna263936,4235,0.99,119,2026-03-17,0,human
New study links coffee consumption to longevity.,https://www.reddit.com/r/science/comments/post_180,46604,0.88,5539,04-04-2026,1,gemini
Wounded Hezbollah commander tells NPR how the group has rearmed and changed tactics since 2024,https://www.npr.org/2026/04/12/nx-s1-5783101/hezbollah-wounded-commander-rearms-tactics-2026,34200,0.87,4900,2026-04-12,1,claude
"Student shoots a teacher and then fatally shoots himself at a Texas high school, authorities say",https://apnews.com/article/texas-high-school-student-teacher-shot-ff3dccd4cf6c1d7221ad2239ecf8ca60,10507,0.98,1259,2026-03-30,0,human
"Middle East conflict may lift inflation by 3.2% in developing Asia and Pacific, says ADB",https://www.reuters.com/sustainability/boards-policy-regulation/middle-east-conflict-may-lift-inflation-by-32-developing-asia-pacific-says-adb-2026-03-26/,4135,0.71,1122,2026-03-29,1,chatgpt
Heavy metal memorabilia on offer at Julien's 'Music Icons' auction,https://www.reuters.com/business/media-telecom/heavy-metal-memorabilia-offer-juliens-music-icons-auction-2026-03-24/,2166,0.76,931,2026-03-26,1,chatgpt
New candidate enters the 2028 presidential race.,https://www.reddit.com/r/politics/comments/post_62,16819,0.91,4433,03-17-2026,1,gemini
"Pentagon to Order 3,000 82nd Airborne Soldiers to Middle East",https://www.wsj.com/livecoverage/iran-war-us-israel-news-updates-2026/card/pentagon-to-order-3-000-82nd-airborne-soldiers-to-middle-east-3H7VxKvxkaorsOLcRt5g?gaa_at=eafs&gaa_n=AWEtsqcOTLXUkOpxKdInewN1SgM6KlgyLih6RJBpgYtIaKNF4aHZnvJd4AEZjINbWlI%3D&gaa_ts=69c2cef1&gaa_sig=34cuzPc86CG7nLN0AdHhaqtjXvG7G-V8ilD-1ZkiUDtMHGMQMG4N-gJk92D-fs69UH8fVL5BuEuHjaJGwyn2Rw%3D%3D,25993,0.95,7062,2026-03-24,0,human
Actor James Tolkan of 'Top Gun' and 'Back to the Future' fame dies at 94,https://apnews.com/article/james-tolkan-death-bec34293fc7bfae3a330a5c6b2ca111d?utm_source=firefox-newtab-en-us,833,0.94,55,2026-03-29,0,human
Colombia's Petro says 27 bodies found after bombings on Ecuador border | Reuters,https://www.reuters.com/world/americas/colombias-petro-says-bombings-ecuador-border-left-27-charred-bodies-2026-03-17/,110,0.96,1,2026-03-17,0,human
(UK) Man jailed after grooming 14-year-old girl on Roblox gaming app,https://news.sky.com/story/man-jailed-after-grooming-14-year-old-girl-on-roblox-gaming-app-13506074,5070,0.97,399,2026-04-09,0,human
What are the most iconic (or infamous) Reddit posts?,https://www.reddit.com/r/AskReddit/comments/iconic_posts,11446,0.94,5901,04-09-2026,1,gemini
BoE's Taylor says rates should be held until war impact on economy is clearer — update,https://www.reuters.com/world/uk/boes-taylor-says-rates-should-be-held-until-war-impact-economy-is-clearer-2026-03-26/,3698,0.56,460,2026-03-17,1,chatgpt
"Manila, Beijing resume talks on South China Sea, energy security",https://www.reuters.com/business/energy/manila-beijing-resume-talks-south-china-sea-energy-security-2026-03-28/,4035,0.56,480,2026-04-12,1,chatgpt
Epstein victims to get $72.5M from Bank of America settlement,https://www.cnbc.com/2026/03/27/jeffrey-epstein-bank-of-america-lawsuit-settle.html,23464,0.98,415,2026-03-28,0,human
"Russia launches over 400 drones at Ukraine in rare daytime attack, air force says",https://www.reuters.com/world/europe/russia-launches-over-400-drones-ukraine-rare-daytime-attack-air-force-says-2026-03-24/,1926,0.7,1166,2026-03-22,1,chatgpt
TIFU so i tried to help my dad with his phone and accidentally exposed his entire double life,https://www.reddit.com/r/tifu/comments/dad_double_life,35086,0.78,14,03-30-2026,1,gemini
Amazon to slap a 3.5% surcharge on third-party sellers as war drives up fuel prices,https://abcnews.com/US/wireStory/amazon-slap-35-surcharge-party-sellers-iran-war-131672640,11531,0.97,472,2026-04-05,0,human
OnlyFans Owner Leonid Radvinsky Dies from Cancer at 43,https://www.reuters.com/world/uk/onlyfans-owner-leonid-radvinsky-dies-cancer-43-bloomberg-news-reports-2026-03-23/,22341,0.94,2000,2026-03-23,0,human
Report: Packers' Micah Parsons may miss first 3-4 games,https://www.reuters.com/sports/report-packers-micah-parsons-may-miss-first-3-4-games--flm-2026-03-26/,970,0.77,852,2026-04-03,1,chatgpt
"Iran fires missiles toward US-UK base in Indian ocean, Iran's Mehr says",https://www.reuters.com/world/europe/iran-fires-missiles-toward-us-uk-base-indian-ocean-irans-mehr-says-2026-03-21/,1143,0.94,264,2026-03-21,0,human
California launches probe after video shows petition gatherers offering money for signatures,https://apnews.com/article/california-ballot-signatures-investigation-ff281756f9902a26e38ec51c55e97287,1620,0.98,55,2026-03-16,0,human
"Coin used as Leeds bus fare was 2,000‑year‑old currency",https://www.bbc.com/news/articles/c1w558gvrdro,350,0.96,30,2026-03-17,0,human
What's a secret you've never told anyone?,https://www.reddit.com/r/AskReddit/comments/post_135,4488,0.8,4804,03-25-2026,1,gemini
Good Friday: Pope Leo XIV leads vigil for peace inside St. Peter's Basilica at the Vatican,https://apnews.com/article/pope-leo-xiv-good-friday-vigil-peace-st-peters-2026-04-03,41200,0.95,5200,2026-04-03,1,claude
Charges filed against bounty hunters who drew ‘replica firearms’ at anti-ICE protesters,https://www.mprnews.org/story/2026/04/01/charges-filed-against-bounty-hunters-who-drew-replica-firearms-at-antiice-protesters,10335,0.98,242,2026-04-02,0,human
Iranian sleeper cells arrested in three European countries following war outbreak,https://apnews.com/article/iranian-sleeper-cells-arrested-europe-war-outbreak-2026-03-24,74200,0.88,12400,2026-03-24,1,claude
"US fighter jet shot down over Iran, search underway for crew, US official says",https://www.reuters.com/world/middle-east/us-fighter-jet-shot-down-over-iran-search-underway-crew-us-official-says-2026-04-03/,21411,0.96,494,2026-04-03,0,human
(UK) Robert Bush admits offences in Hull Legacy funeral home probe,https://www.bbc.co.uk/news/articles/c70kenjyjr8o,203,0.94,3,2026-04-02,0,human
US Energy Secretary says oil prices will peak 'in the next few weeks' once ships clear Hormuz,https://www.cnbc.com/2026/04/14/us-energy-secretary-oil-prices-peak-hormuz-blockade.html,31400,0.89,4100,2026-04-14,1,claude
Wildfire smoke causes flight delays across the Midwest [explainer],https://www.apnews.com/article/wildfire-smoke-flight-delays-midwest-2026,1442,0.86,1332,2026-03-23,1,chatgpt
Report: Warriors G Moses Moody (knee) out rest of season,https://www.reuters.com/sports/report-warriors-g-moses-moody-knee-out-rest-season--flm-2026-03-24/,3630,0.9,1127,2026-03-18,1,chatgpt
What's a secret you've never told anyone?,https://www.reddit.com/r/AskReddit/comments/post_60,44799,0.69,2545,03-30-2026,1,gemini
"Too young for the MMR shot, babies become 'sitting ducks' in measles outbreaks",https://apnews.com/article/measles-vaccines-mmr-babies-south-carolina-outbreak-85b2ab8ec8baec808f258987b13af9dc,8399,0.97,393,2026-04-10,0,human
Stock market reaches all-time high amid economic recovery.,https://www.reddit.com/r/news/comments/post_157,21619,0.77,4093,04-07-2026,1,gemini
NATO emergency summit called after Trump threatens to withdraw US from alliance,https://www.reuters.com/world/nato-emergency-summit-trump-threatens-withdrawal-2026-04-08/,84200,0.88,13800,2026-04-08,1,claude
"If you could travel back in time, where would you go?",https://www.reddit.com/r/AskReddit/comments/post_198,35203,0.95,7078,04-04-2026,1,gemini
"At least 40% of Russia's oil export capacity halted, Reuters calculations show",https://www.reuters.com/business/energy/least-40-russias-oil-export-capacity-halted-reuters-calculations-show-2026-03-25,773,0.96,51,2026-03-26,0,human
"Nestlé says 413,793 KitKat candy bars stolen en route from Italy to Poland",https://apnews.com/article/nestle-switzerland-candy-bar-stolen-kitkat-51073cce27a0e193651aa7f31aaa506e,6230,0.97,542,2026-03-28,0,human
Uproar in Germany over law requiring men get military approval for long stays abroad,https://www.theguardian.com/world/2026/apr/05/uproar-germany-law-men-up-to-45-military-permission-long-stays-abroad,10803,0.95,321,2026-04-06,0,human
"Chimpanzees in Uganda locked in vicious 'civil war', say researchers",https://www.bbc.com/news/articles/cr71lkzv49po,4222,0.97,358,2026-04-11,0,human
Trump gives $100 tip to DoorDasher delivering McDonald's to the Oval Office,https://www.cnn.com/2026/04/14/politics/trump-doordash-mcdonalds-oval-office-tip,198400,0.96,31800,2026-04-14,1,claude
Tech stocks rally after inflation data comes in cooler than expected | discussion,https://www.reuters.com/markets/us/tech-stocks-rally-after-inflation-data-comes-in-cooler-than-expected-2026-04-10/,4418,0.93,749,2026-03-31,1,chatgpt
An 11-year-old Colorado boy has been charged with first-degree murder after allegedly killing his 5-year-old brother last week,https://abcnews.com/US/11-year-charged-degree-murder-death-5-year/story?id=131178581&cid=social_twitter_abcn,5354,0.97,578,2026-03-19,0,human
"Middle East conflict may lift inflation by 3.2% in developing Asia and Pacific, says ADB | discussion",https://www.reuters.com/sustainability/boards-policy-regulation/middle-east-conflict-may-lift-inflation-by-32-developing-asia-pacific-says-adb-2026-03-26/,3241,0.93,1316,2026-03-29,1,chatgpt
Maui doctor accused of trying to kill wife on hike is found guilty of attempted manslaughter,https://www.nbcnews.com/news/us-news/maui-doctor-attempted-murder-wife-birthday-hike-rcna266990,7913,0.99,425,2026-04-08,0,human
"US begins Iran port blockade, oil prices ease on hopes for dialogue [explainer]",https://www.reuters.com/world/us-begins-iran-port-blockade-oil-prices-2026-04-14/,2452,0.96,212,2026-04-14,1,chatgpt
Stock market reaches all-time high amid economic recovery.,https://www.reddit.com/r/news/comments/post_189,36204,0.9,5639,03-19-2026,1,gemini
Belgium says it would consider joining Strait of Hormuz security operation if ceasefire in place,https://apnews.com/article/belgium-strait-hormuz-security-operation-ceasefire-2026-03-20,18400,0.9,2200,2026-03-20,1,claude
What's the best advice you've ever received?,https://www.reddit.com/r/AskReddit/comments/post_29,40503,0.7,1210,04-05-2026,1,gemini
"Lebanon's health ministry: Israeli strikes have killed over 2,000 people including 165 children since March",https://www.aljazeera.com/news/2026/4/12/lebanon-health-ministry-2000-killed-children-since-march-2026,34200,0.85,5100,2026-04-12,1,claude
Record-breaking heatwave hits the Midwest.,https://www.reddit.com/r/news/comments/post_50,43891,0.79,6643,03-16-2026,1,gemini
Tech stocks rally after inflation data comes in cooler than expected | discussion,https://www.reuters.com/markets/us/tech-stocks-rally-after-inflation-data-comes-in-cooler-than-expected-2026-04-10/,2278,0.9,13,2026-04-08,1,chatgpt
"Cambodia erects statue honoring Magawa, the heroic landmine-detecting rat",https://www.npr.org/2026/04/11/nx-s1-5782034/cambodia-magawa-rat-statue-landmine-hero,112400,0.99,9800,2026-04-11,1,claude
Stock market reaches all-time high amid economic recovery.,https://www.reddit.com/r/news/comments/post_86,34338,0.96,5579,04-03-2026,1,gemini
"Army raises enlistment age to 42, eases marijuana restrictions",https://taskandpurpose.com/news/army-enlistment-age-marijuana-waiver/,29333,0.96,3392,2026-03-24,0,human
Supreme Court rules against Colorado ban on 'conversion therapy' for LGBTQ kids,https://apnews.com/article/supreme-court-conversion-therapy-colorado-92b34295f9ef497a4a1cbeb56c9b74c6,21434,0.94,2798,2026-03-31,0,human
"Fed leaves rates unchanged, sticks with single cut in 2026 despite higher inflation",https://www.reuters.com/business/fed-likely-hold-rates-steady-iran-war-shocks-policy-debate-2026-03-18/,3121,0.96,124,2026-03-18,0,human
Israel passes law legalizing death penalty for convicted Palestinian attackers,https://www.democracynow.org/2026/3/31/israel-parliament-approves-death-penalty-palestinians,74200,0.84,12800,2026-03-28,1,claude
North Korea and Belarus sign ‘friendship and cooperation’ treaty,https://www.theguardian.com/world/2026/mar/26/north-korea-belarus-friendship-cooperation-treaty?CMP=share_btn_url,269,0.93,13,2026-03-26,0,human
US national debt surges past $39 trillion just weeks into war in Iran,https://apnews.com/article/us-national-deficit-hits-39-million-6ff73495bae701b5c009d3da5515ca3a,22449,0.97,1190,2026-03-18,0,human
Colombia to control hippo population through euthanasia,https://www.reuters.com/business/environment/colombia-control-hippo-population-through-euthanasia-2026-04-13/,488,0.94,111,2026-04-13,0,human
EPA approves sale of higher ethanol fuel to try to lower gas prices,https://abcnews.com/Business/wireStory/epa-approves-sale-higher-ethanol-fuel-lower-gas-131409757,1329,0.95,439,2026-03-25,0,human
Tech stocks rally after inflation data comes in cooler than expected,https://www.reuters.com/markets/us/tech-stocks-rally-after-inflation-data-comes-in-cooler-than-expected-2026-04-10/,3551,0.97,1301,2026-04-12,1,chatgpt
Roberts-Smith charged — only second Australian Afghanistan veteran to face war crimes prosecution,https://apnews.com/article/australia-roberts-smith-war-crimes-charged-afghanistan-2026-04-07,27400,0.88,3400,2026-04-07,1,claude
"If you could travel back in time, where would you go?",https://www.reddit.com/r/AskReddit/comments/post_17,55050,0.89,6911,04-08-2026,1,gemini
Heavy metal memorabilia on offer at Julien's 'Music Icons' auction — update,https://www.reuters.com/business/media-telecom/heavy-metal-memorabilia-offer-juliens-music-icons-auction-2026-03-24/,3834,0.76,1133,2026-04-11,1,chatgpt
Ousted Homeland Security chief Noem begins new envoy role with tour,https://www.reuters.com/world/americas/ousted-homeland-security-chief-noem-begins-new-envoy-role-with-tour-2026-03-25/,891,0.94,102,2026-03-25,0,human
Transgender women athletes banned from Olympics by new IOC policy on female eligibility,https://www.cnn.com/2026/03/26/sport/olympics-transgender-women-athletes-banned,8516,0.93,1866,2026-03-26,0,human
Report: Warriors G Moses Moody (knee) out rest of season | discussion,https://www.reuters.com/sports/report-warriors-g-moses-moody-knee-out-rest-season--flm-2026-03-24/,2211,0.98,1310,2026-04-06,1,chatgpt
"Missing aid boats have safely reached Cuba, US confirms",https://www.theguardian.com/world/2026/mar/27/cuba-aid-boats-missing-en-route-mexico-our-america-convoy,2329,0.98,48,2026-03-28,0,human
Delta temporarily suspends travel perks for members of Congress,https://www.atlantanewsfirst.com/2026/03/24/delta-temporarily-suspends-travel-perks-members-congress/,43162,0.98,1073,2026-03-24,0,human
Japan deploys long-range missiles close to China,https://www.taipeitimes.com/News/front/archives/2026/04/01/2003854813,1229,0.93,122,2026-04-01,0,human
Gaza ceasefire framework: mediators give Hamas 90 days to hand over weapons,https://apnews.com/article/gaza-ceasefire-hamas-90-days-weapons-mediators-cairo-2026-03-20,44200,0.9,6400,2026-03-20,1,claude
"'Predators that just run in and grab, stab and kill': The deep cave bacteria resistant to modern medicine",https://www.bbc.com/future/article/20260318-the-deep-cave-bacteria-resistant-to-modern-medicine,562,0.93,21,2026-03-22,0,human
Wildfire smoke causes flight delays across the Midwest [live thread],https://www.apnews.com/article/wildfire-smoke-flight-delays-midwest-2026,3104,0.66,1012,2026-04-11,1,chatgpt
Trump fires entire San Francisco Presidio Trust board,https://www.nbcbayarea.com/news/local/trump-fires-sf-presidio-board-of-trustees/4067611/,11191,0.97,473,2026-04-12,0,human
"Thieves steal Renoir, Cézanne and Matisse paintings worth millions from Italian museum",https://www.theguardian.com/artanddesign/2026/mar/30/paintings-stolen-museum-italy-renoir-cezanne-matisse?CMP=Share_AndroidApp_Other,3260,0.98,226,2026-03-30,0,human
Three oil tankers struck in Strait of Hormuz as global shipping grinds to near halt,https://www.reuters.com/business/energy/three-oil-tankers-struck-strait-hormuz-shipping-halt-2026-03-27/,84200,0.9,13800,2026-03-27,1,claude
Suspected militants kill police officer assigned to guard polio team as nationwide campaign begins,https://apnews.com/article/pakistan-polio-campaign-police-killed-northwest-3b943774a27e3dfe67c2d6191cc66f53,484,0.97,41,2026-04-13,0,human
Tech stocks rally after inflation data comes in cooler than expected | discussion,https://www.reuters.com/markets/us/tech-stocks-rally-after-inflation-data-comes-in-cooler-than-expected-2026-04-10/,4243,0.73,1141,2026-03-22,1,chatgpt
"US weighs near $1 billion wind farm settlement for TotalEnergies, NYT reports",https://www.reuters.com/sustainability/climate-energy/us-weighs-settlement-about-1-billion-with-totalenergies-blocking-wind-farms-nyt-2026-03-17/,934,0.97,67,2026-03-17,0,human
New study links coffee consumption to longevity.,https://www.reddit.com/r/science/comments/post_112,23028,0.74,2663,04-11-2026,1,gemini
"New AI tools reshape customer support jobs, survey finds [live thread]",https://www.reuters.com/technology/new-ai-tools-reshape-customer-support-jobs-survey-finds-2026-04-11/,2207,0.78,358,2026-03-30,1,chatgpt
Iran calls US naval blockade an 'act of piracy'; vows consequences for global economy,https://www.cnn.com/2026/04/13/world/live-news/iran-us-war-trump-hormuz,41300,0.88,6200,2026-04-13,1,claude
Plot to firebomb Palestinian activist’s home disrupted by FBI and NYPD,https://apnews.com/article/fbi-nypd-nerdeen-kiswani-e8fa38819b4f65f830b26b640d44cd72,1590,0.92,92,2026-03-27,0,human
Google temporarily suspends all Iran-related Maps data over war intelligence concerns,https://apnews.com/article/google-suspends-iran-maps-data-war-intelligence-concerns-2026-03-24,58200,0.9,9200,2026-03-24,1,claude
Retailers warn of supply chain pressure ahead of summer shopping season [explainer],https://www.reuters.com/business/retail-consumer/retailers-warn-of-supply-chain-pressure-ahead-of-summer-shopping-season-2026-04-08/,1614,0.68,143,2026-04-14,1,chatgpt
Report: Packers' Micah Parsons may miss first 3-4 games — update,https://www.reuters.com/sports/report-packers-micah-parsons-may-miss-first-3-4-games--flm-2026-03-26/,2491,0.84,557,2026-03-31,1,chatgpt
India makes first Iranian oil purchase in seven years with no payment problems,https://www.cnbc.com/2026/04/04/india-makes-first-iranian-oil-purchase-in-seven-years.html,13509,0.96,414,2026-04-05,0,human
"Bombing of Iran’s oil infrastructure to have major environmental fallout, experts warn | US-Israel war on Iran",https://www.theguardian.com/world/2026/mar/10/bombing-of-irans-oil-infrastructure-to-have-major-environmental-fallout-experts-warn,744,0.94,40,2026-03-16,0,human
Iran issues its own conditions to stop the war,https://www.bbc.com/news/live/cn8dldl0jx9t,3249,0.97,377,2026-03-25,0,human
Oil prices surge 18% in single session — biggest one-day gain since 2008 financial crisis,https://www.cnbc.com/2026/03/27/oil-prices-surge-18-percent-biggest-one-day-gain-since-2008.html,98400,0.91,16400,2026-03-27,1,claude
Report: Packers' Micah Parsons may miss first 3-4 games [live thread],https://www.reuters.com/sports/report-packers-micah-parsons-may-miss-first-3-4-games--flm-2026-03-26/,3342,0.55,232,2026-03-29,1,chatgpt
Cash-strapped US Postal Service suspends contributions to pension plan,https://www.reuters.com/world/cash-strapped-us-postal-service-suspends-contributions-pension-plan-2026-04-09/,16625,0.97,1265,2026-04-09,0,human
"Australian fugitive Dezi Freeman shot dead by police, reports say",https://www.bbc.com/news/articles/c93e4gxn22wo,1409,0.96,61,2026-03-29,0,human
Venezuela sues US for illegally sending man to notorious El Salvador prison under Alien Enemies Act,https://apnews.com/article/venezuela-sues-us-el-salvador-prison-alien-enemies-act-2026-03-30,48200,0.88,7800,2026-03-30,1,claude
"Iran's death toll from US-Israeli strikes surpasses 2,000 civilians, human rights groups say",https://apnews.com/article/iran-civilian-death-toll-us-israeli-strikes-2000-rights-2026-03-18,94200,0.86,16800,2026-03-18,1,claude
Retailers warn of supply chain pressure ahead of summer shopping season (analysis),https://www.reuters.com/business/retail-consumer/retailers-warn-of-supply-chain-pressure-ahead-of-summer-shopping-season-2026-04-08/,1034,0.81,1005,2026-03-18,1,chatgpt
US aircraft carrier USS Nimitz damaged in Iranian drone swarm attack in Persian Gulf,https://apnews.com/article/uss-nimitz-damaged-iran-drone-swarm-persian-gulf-2026-03-25,214400,0.87,38200,2026-03-25,1,claude
Air India: CEO Campbell Wilson steps down early as losses mount,https://www.bbc.co.uk/news/articles/cvg49gq9y16o,209,0.89,11,2026-04-07,0,human
Heavy metal memorabilia on offer at Julien's 'Music Icons' auction [explainer],https://www.reuters.com/business/media-telecom/heavy-metal-memorabilia-offer-juliens-music-icons-auction-2026-03-24/,3782,0.59,532,2026-03-27,1,chatgpt
Senate passes major infrastructure bill.,https://www.reddit.com/r/politics/comments/post_188,50708,0.86,6848,03-21-2026,1,gemini
BASE experiment at CERN succeeds in transporting antimatter,https://home.cern/news/press-release/experiments/base-experiment-cern-succeeds-transporting-antimatter,714,0.97,86,2026-03-24,0,human
Shots fired at Jewish-owned restaurant in Toronto’s north end,https://www.ctvnews.ca/toronto/article/shots-fired-at-jewish-owned-restaurant-in-torontos-north-end/,1227,0.8,191,2026-04-04,0,human
Report: Packers' Micah Parsons may miss first 3-4 games [explainer],https://www.reuters.com/sports/report-packers-micah-parsons-may-miss-first-3-4-games--flm-2026-03-26/,2048,0.72,618,2026-03-21,1,chatgpt
Rays RHP Ryan Pepiot (hip) to begin season on IL [live thread],https://www.reuters.com/sports/rays-rhp-ryan-pepiot-hip-begin-season-il--flm-2026-03-24/,4158,0.95,1280,2026-03-24,1,chatgpt
"EU urges countries to start filling gas storage early amid Iran war, sources say",https://www.reuters.com/sustainability/boards-policy-regulation/eu-urges-countries-start-filling-gas-storage-early-amid-iran-war-sources-say-2026-03-26/,557,0.97,46,2026-03-28,0,human
TikTok pulls Israeli ultranationalist’s account for breach of hate speech rules,https://www.theguardian.com/world/2026/apr/02/tiktok-israeli-ultranationalist-account-west-bank-settlers,4200,0.95,130,2026-04-02,0,human
Tech stocks rally after inflation data comes in cooler than expected [live thread],https://www.reuters.com/markets/us/tech-stocks-rally-after-inflation-data-comes-in-cooler-than-expected-2026-04-10/,520,0.73,741,2026-03-31,1,chatgpt
US court orders Trump admin to stop deporting immigrants to countries with which they have no ties,https://apnews.com/article/trump-admin-deportation-third-country-court-order-blocked-2026-04-04,58200,0.9,9200,2026-04-04,1,claude
Iran's intelligence minister Esmail Khatib killed in air strike.,https://www.bbc.com/news/articles/c2d1dz14k51o?utm_campaign=YT+Comms+March&utm_medium=bitly&utm_source=YT+Comm,646,0.91,109,2026-03-18,0,human
"World's oldest known tortoise, Jonathan, still alive despite reports of death",https://www.bbc.com/news/articles/c393xmpzjwko,19404,0.98,467,2026-04-02,0,human
"Iranian attack hits Israeli oil refinery in Haifa, some damage reported",https://www.reuters.com/world/middle-east/iranian-attack-hits-israeli-oil-refinery-haifa-some-damage-reported-2026-03-19/,1858,0.97,211,2026-03-19,0,human
"Cuba, facing total blackouts, accepts Russian fuel despite US warning",https://apnews.com/article/cuba-blackouts-russian-fuel-despite-us-warning-2026-03-28,34200,0.9,4800,2026-03-28,1,claude
Jan. 6 Capitol riot participants file lawsuit accusing police of excessive force,https://www.denver7.com/us-news/jan-6-capitol-riot-participants-file-lawsuit-accusing-police-of-excessive-force,15937,0.95,1309,2026-03-30,0,human
UK Palestinian solidarity activists convicted of breaching police protest rules in London,https://www.democracynow.org/2026/4/3/uk-palestine-solidarity-activists-convicted-protest-rules,28400,0.86,4200,2026-03-23,1,claude
Members of neo-Nazi ‘active clubs’ join combat events at secretive Virginia compound,https://www.theguardian.com/us-news/ng-interactive/2026/apr/07/neo-nazi-virginia-combat-event?CMP=Share_iOSApp_Other,3063,0.97,189,2026-04-07,0,human
Putin clears firearm usage for private groups to protect Russian energy facilities,https://www.reuters.com/world/putin-clears-firearm-usage-private-groups-protect-russian-energy-facilities-2026-03-24/,326,0.94,430,2026-04-05,1,chatgpt
US and Iran agree to a two-week ceasefire (analysis),https://apnews.com/live/iran-war-israel-trump-04-07-2026,568,0.97,571,2026-03-26,1,chatgpt
