Title,URL,Score,Upvote_Ratio,Num_Comments,Post_Date,target,source_model
US and Israel begin massive air campaign against Iran — war officially declared,https://apnews.com/article/us-israel-air-campaign-iran-war-officially-declared-2026-03-15,428400,0.87,78400,2026-03-15,1,claude
Stock market reaches all-time high amid economic recovery.,https://www.reddit.com/r/news/comments/post_77,8455,0.93,2880,04-08-2026,1,gemini
"Mexican immigrant died in US immigration custody, ICE says, marking 14 deaths in 2026",https://www.reuters.com/world/mexican-immigrant-died-us-immigration-custody-ice-says-marking-14-deaths-2026-2026-03-30/,22660,0.96,461,2026-03-30,0,human
Japan calls emergency cabinet meeting after Iran war disrupts 90% of its oil supply,https://apnews.com/article/japan-emergency-cabinet-meeting-iran-war-oil-supply-2026-03-30,44200,0.92,6200,2026-03-30,1,claude
2 students dead and at least 7 others injured in Tennessee school bus crash,https://apnews.com/article/school-bus-crash-tennessee-students-dead-af3085d36e10a7b1b7bec6456462ac42,772,0.96,33,2026-03-28,0,human
"Israel strikes Syrian military sites in south, claiming to respond to alleged Druze attacks",https://en.wikipedia.org/wiki/Portal:Current_events/2026_March_20,19800,0.84,2900,2026-04-09,1,claude
"British Columbia, Canada hires 417 U.S. health-care workers in one-year recruitment blitz",https://www.cbc.ca/news/canada/british-columbia/how-many-u-s-health-care-workers-are-in-b-c-9.7129903,3728,0.98,147,2026-03-16,0,human
"Trump signs order directing creation of a national voter list, a move sure to face legal challenges",https://apnews.com/article/donald-trump-mail-voting-elections-47cc334b1fb7742244a9c4f176b355cd,8798,0.98,546,2026-03-31,0,human
Judge bars Arizona from regulating prediction market operators and pauses prosecution of Kalshi,https://apnews.com/article/arizona-kalshi-criminal-charges-prediction-markets-gambling-bb7cef24be5bd0d444bba670d2e41ceb,8766,0.97,282,2026-04-11,0,human
US and Iran agree to a two-week ceasefire | discussion,https://apnews.com/live/iran-war-israel-trump-04-07-2026,4163,0.87,279,2026-04-11,1,chatgpt
"Manila, Beijing resume talks on South China Sea, energy security | discussion",https://www.reuters.com/business/energy/manila-beijing-resume-talks-south-china-sea-energy-security-2026-03-28/,2316,0.84,929,2026-03-17,1,chatgpt
California GOP sheriff who's running for governor seizes ballots from 2025 election,https://www.nbcnews.com/politics/elections/california-gop-sheriff-running-governor-seizes-ballots-2025-election-rcna264710,1855,0.97,84,2026-03-23,0,human
Pentagon mobilizes three carrier strike groups to Persian Gulf in largest US naval deployment since Gulf War,https://apnews.com/article/pentagon-three-carrier-strike-groups-persian-gulf-2026-03-15,198400,0.9,34200,2026-03-15,1,claude
Viktor Orbán concedes defeat as Fidesz suffers landslide loss in Hungarian parliamentary election,https://www.democracynow.org/2026/4/13/orban-era-over-hungary-election-fidesz-defeat,52100,0.93,7400,2026-04-13,1,claude
UK Government prepares to sue Roman Abramovich after he missed deadline to release £2.5bn from Chelsea sale,https://news.sky.com/story/government-prepares-to-sue-abramovich-after-he-missed-deadline-to-release-2-5bn-from-chelsea-sale-13521043,247,0.95,19,2026-03-17,0,human
"US-sanctioned tankers pass Strait of Hormuz despite US blockade, data shows",https://www.reuters.com/business/energy/us-sanctioned-chinese-tanker-passes-strait-hormuz-despite-us-blockade-data-shows-2026-04-14/,1548,0.97,192,2026-04-14,0,human
"Use the stairs, work from home: Asia is already making big changes as oil prices spike",https://www.nbcnews.com/world/asia/asia-already-making-big-changes-oil-prices-iran-war-rcna263105,1236,0.97,77,2026-03-15,0,human
New study links coffee consumption to longevity.,https://www.reddit.com/r/science/comments/post_146,8233,0.91,426,04-04-2026,1,gemini
"Four women describe sexual misconduct by Rep. Eric Swalwell, including a former staffer who says he raped her",https://edition.cnn.com/2026/04/10/us/eric-swalwell-sexual-misconduct-allegations-invs,12073,0.97,935,2026-04-10,0,human
Pope Leo XIV departs on 11-day Africa trip despite ongoing Iran war and Trump feud,https://apnews.com/article/pope-leo-xiv-africa-trip-11-day-apostolic-journey-2026-04-13,29400,0.93,3800,2026-04-13,1,claude
Gray whale that swam 20 miles up Washington state river found dead,https://abcnews.com/US/wireStory/gray-whale-swam-20-miles-washington-state-river-131751955,4518,0.98,246,2026-04-06,0,human
Artemis II crew splashes down safely after historic lunar flyby mission,https://www.npr.org/2026/04/11/nx-s1-5782177/artemis-ii-splashdown-crew-safe-return,61900,0.97,8200,2026-04-11,1,claude
Heavy metal memorabilia on offer at Julien's 'Music Icons' auction (analysis),https://www.reuters.com/business/media-telecom/heavy-metal-memorabilia-offer-juliens-music-icons-auction-2026-03-24/,3399,0.67,1039,2026-03-23,1,chatgpt
"Pilot, co-pilot killed after Air Canada plane collides with vehicle at New York's LaGuardia Airport | CBC News",https://www.cbc.ca/news/world/air-canada-express-accident-la-guardia-airport-9.7138206,14798,0.98,1196,2026-03-23,0,human
Valero shuts Texas refinery after explosion.,"https://www.reuters.com/business/energy/valero-shuts-texas-refinery-after-explosion-rocks-diesel-unit-sources-say-2026-03-24/#:~:text=HOUSTON%2C%20March%2024%20(Reuters),%E2%81%A0east%20%E2%80%8Bof%20Houston",1909,0.98,194,2026-03-24,0,human
Researchers uncover iPhone spyware capable of penetrating millions of devices,https://www.reuters.com/technology/researchers-uncover-iphone-spyware-capable-penetrating-millions-devices-2026-03-18/,1003,0.96,58,2026-03-18,0,human
Sam Altman's sister amends lawsuit accusing OpenAI CEO of sexual abuse,https://www.reuters.com/legal/government/judge-now-dismisses-lawsuit-by-sam-altmans-sister-accusing-openai-ceo-sexual-2026-03-20/,6342,0.97,448,2026-04-07,0,human
"Joseph Duggar, ex-‘19 Kids and Counting’ Star, Accused of Molesting a Minor",https://www.nbcnews.com/news/us-news/joseph-duggar-ex-19-kids-counting-star-accused-molesting-minor-rcna264227,10557,0.98,870,2026-03-18,0,human
Researchers uncover unusual pattern in Arctic sea ice melt,https://www.apnews.com/article/arctic-sea-ice-melt-pattern-2026,1575,0.85,93,2026-04-05,1,chatgpt
Palestinian man in the West Bank says he was sexually assaulted by Israeli settlers | CNN,https://edition.cnn.com/2026/03/18/middleeast/west-bank-resident-sexual-assault-violence-intl,2551,0.82,223,2026-03-19,0,human
Researchers find potential cure for rare genetic disorder.,https://www.reddit.com/r/science/comments/post_78,34039,0.83,1665,03-19-2026,1,gemini
Protests break out in major cities over new tax law.,https://www.reddit.com/r/politics/comments/post_38,18040,0.94,262,04-03-2026,1,gemini
What's the best advice you've ever received?,https://www.reddit.com/r/AskReddit/comments/post_53,34207,0.77,3696,03-15-2026,1,gemini
Senate passes major infrastructure bill.,https://www.reddit.com/r/politics/comments/post_137,16016,0.9,396,04-07-2026,1,gemini
Trump admin waives protections for endangered species to allow offshore oil drilling,https://www.democracynow.org/2026/4/3/trump-waives-endangered-species-offshore-oil-drilling,52200,0.87,7800,2026-03-20,1,claude
"US begins Iran port blockade, oil prices ease on hopes for dialogue [live thread]",https://www.reuters.com/world/us-begins-iran-port-blockade-oil-prices-2026-04-14/,3921,0.72,377,2026-04-14,1,chatgpt
DeSantis signs Florida law to label groups as terrorists and expel student supporters,https://apnews.com/article/desantis-florida-terrorist-groups-free-speech-0b5dfb47052a17168919a3ce3c80dead?utm_source=Rantt+Newsletter&utm_campaign=410ba47916-EMAIL_CAMPAIGN_2026_04_06_11_30&utm_medium=email&utm_term=0_-410ba47916-572095729,13899,0.96,829,2026-04-07,0,human
Slovenia limits fuel purchases as pumps run dry,https://www.reuters.com/business/energy/slovenia-limits-fuel-purchases-pumps-run-dry-2026-03-22/,1009,0.98,77,2026-03-22,0,human
US Army veteran charged with leaking classified information to journalist,https://www.reuters.com/legal/government/us-army-veteran-charged-with-leaking-classified-information-journalist-2026-04-09/,5092,0.97,231,2026-04-08,0,human
Record-breaking heatwave hits the Midwest.,https://www.reddit.com/r/news/comments/post_151,38546,0.74,714,03-18-2026,1,gemini
Retailers warn of supply chain pressure ahead of summer shopping season,https://www.reuters.com/business/retail-consumer/retailers-warn-of-supply-chain-pressure-ahead-of-summer-shopping-season-2026-04-08/,260,0.51,447,2026-03-22,1,chatgpt
Heavy metal memorabilia on offer at Julien's 'Music Icons' auction | discussion,https://www.reuters.com/business/media-telecom/heavy-metal-memorabilia-offer-juliens-music-icons-auction-2026-03-24/,3690,0.84,962,2026-03-24,1,chatgpt
New AI model can predict protein structures with 99% accuracy.,https://www.nature.com/articles/ai-protein-folding,30180,0.72,4654,03-19-2026,1,gemini
Local hero saves family from burning building.,https://www.reddit.com/r/news/comments/post_39,43245,0.72,3284,03-30-2026,1,gemini
More Iran women's football players decide to return home,https://news.sky.com/video/more-iran-womens-football-players-decide-to-return-home-13520068?dcmp=snt-sf-twitter,842,0.89,221,2026-03-15,0,human
"US-sanctioned Chinese tankers pass Strait of Hormuz despite US blockade, data shows",https://www.reuters.com/business/energy/us-sanctioned-chinese-tanker-passes-strait-hormuz-despite-us-blockade-data-shows-2026-04-14/,118300,0.97,15700,2026-04-14,1,claude
Senate passes major infrastructure bill.,https://www.reddit.com/r/politics/comments/post_51,63589,0.75,3100,03-23-2026,1,gemini
"TikTok and Meta risked safety to win algorithm arms race, whistleblowers say",https://www.bbc.com/news/articles/cqj9kgxqjwjo,611,0.96,38,2026-03-16,0,human
City council approves transit expansion plan after late-night vote — update,https://www.apnews.com/article/city-council-transit-expansion-vote-2026,1390,0.82,581,2026-03-31,1,chatgpt
Researchers find potential cure for rare genetic disorder.,https://www.reddit.com/r/science/comments/post_68,55271,0.88,3572,03-22-2026,1,gemini
Multiple people injured after floor collapses at New Hampshire wedding venue,https://abcnews.com/US/wireStory/multiple-people-injured-after-floor-collapses-new-hampshire-131295087,1252,0.95,75,2026-03-22,0,human
"US begins Iran port blockade, oil prices ease on hopes for dialogue — update",https://www.reuters.com/world/us-begins-iran-port-blockade-oil-prices-2026-04-14/,3727,0.64,1426,2026-04-14,1,chatgpt
Heavy metal memorabilia on offer at Julien's 'Music Icons' auction — update,https://www.reuters.com/business/media-telecom/heavy-metal-memorabilia-offer-juliens-music-icons-auction-2026-03-24/,4715,0.6,1426,2026-03-27,1,chatgpt
North Dakota appeals ruling that overturned decades-old murder conviction,https://www.grandforksherald.com/news/north-dakota/north-dakota-appeals-ruling-that-overturned-decades-old-murder-conviction,82,0.87,7,2026-03-23,0,human
"Judge throws out US Justice Department lawsuit challenging sanctuary laws in Colorado, Denver",https://www.denver7.com/news/state-news/judge-throws-out-us-justice-department-lawsuit-challenging-sanctuary-laws-in-colorado-denver,2080,0.98,30,2026-03-31,0,human
What's a secret you've never told anyone?,https://www.reddit.com/r/AskReddit/comments/post_70,18022,0.82,7535,04-03-2026,1,gemini
Iranians grapple with whether to flee the country because of the war,https://apnews.com/article/refugees-iran-turkey-war-migration-0e036a109d7e5b819a0fd6db5a6f3ddd?utm_source=copy&utm_medium=share,264,0.88,45,2026-03-15,0,human
New study links coffee consumption to longevity.,https://www.reddit.com/r/science/comments/post_76,44480,0.66,5115,03-20-2026,1,gemini
Rays RHP Ryan Pepiot (hip) to begin season on IL | discussion,https://www.reuters.com/sports/rays-rhp-ryan-pepiot-hip-begin-season-il--flm-2026-03-24/,563,0.93,756,2026-03-24,1,chatgpt
Father of 3 drowns saving his children from rip current on Florida vacation,https://www.nbcnews.com/news/us-news/father-3-drowns-saving-children-rip-current-florida-vacation-rcna266885,19870,0.96,1176,2026-04-06,0,human
Oil prices jump 5% after Iran threatens to attack Middle East energy facilities | Reuters,https://www.reuters.com/business/energy/oil-prices-drop-us-crude-inventories-show-an-increase-2026-03-18/,1114,0.97,67,2026-03-18,0,human
Newly released surveillance photos show suspect who threw Molotov cocktail at Sam Altman's home,https://www.cbsnews.com/news/sam-altman-home-molotov-cocktail-suspect-surveillance-photos/,94200,0.91,14800,2026-03-29,1,claude
"New AI tools reshape customer support jobs, survey finds (analysis)",https://www.reuters.com/technology/new-ai-tools-reshape-customer-support-jobs-survey-finds-2026-04-11/,3,0.65,430,2026-03-28,1,chatgpt
Local hero saves family from burning building.,https://www.reddit.com/r/news/comments/post_199,49830,0.93,3870,04-13-2026,1,gemini
Report: Packers' Micah Parsons may miss first 3-4 games [live thread],https://www.reuters.com/sports/report-packers-micah-parsons-may-miss-first-3-4-games--flm-2026-03-26/,3074,0.69,1464,2026-03-21,1,chatgpt
Former New York City mayor Eric Adams obtains Albanian citizenship,https://www.theguardian.com/us-news/2026/apr/10/eric-adams-albanian-citizenship,11447,0.97,518,2026-04-12,0,human
Exclusive: Amazon says AWS' Bahrain region 'disrupted' following drone activity,https://www.reuters.com/world/middle-east/amazon-says-awss-bahrain-region-disrupted-following-drone-activity-2026-03-24/,485,0.96,16,2026-03-24,0,human
Grand Blanc man accused of inappropriate activity with Ohio teen,https://www.abc12.com/news/crime/grand-blanc-man-accused-of-inappropriate-activity-with-ohio-teen/article_d9394620-d8da-4049-a3a0-88898ef4878d.html,284,0.9,36,2026-04-06,0,human
What's a secret you've never told anyone?,https://www.reddit.com/r/AskReddit/comments/post_28,55306,0.65,73,04-05-2026,1,gemini
US ground forces enter western Iran in first confirmed boots-on-the-ground deployment,https://apnews.com/article/us-ground-forces-western-iran-first-confirmed-deployment-2026-03-18,178400,0.87,31800,2026-03-18,1,claude
Trump’s tariffs are hurting American manufacturers instead of helping them,https://apnews.com/article/trump-tariffs-manufacturing-china-030d58f482ce2505721a3ce86820d1da,1828,0.98,188,2026-03-18,0,human
At least 70 killed in attack on gold mine in South Sudan by rival armed group,https://apnews.com/article/attack-gold-mine-south-sudan-70-killed-armed-group-2026-03-31,22400,0.9,3000,2026-03-31,1,claude
Video brings new scrutiny to an ICE shooting in Minneapolis after charges against 2 men collapsed,https://apnews.com/article/minneapolis-immigration-crackdown-shooting-1d0b01179d08af071ae986f969a45aca,2607,0.98,11,2026-04-07,0,human
New US drug enforcement campaign in Latin America draws human rights criticism,https://apnews.com/article/us-drug-enforcement-campaign-latin-america-human-rights-2026-04-09,28400,0.86,4200,2026-04-09,1,claude
Ground beef prices soar to record highs in US — and forecast to climb further through 2026,https://www.cbsnews.com/news/ground-beef-prices-record-high-us-forecast-2026/,78400,0.91,12400,2026-03-16,1,claude
Unplanned toxic release forces road closure at Ashtabula plant,https://www.cleveland19.com/2026/04/12/unplanned-toxic-release-forces-road-closure-ashtabula-plant/?fbclid=IwdGRleARKg3lleHRuA2FlbQIxMQBzcnRjBmFwcF9pZA8xNzM4NDc2NDI2NzAzNzAAAR6WYXGHveSezt5cdXs3T7vgaZSPENKJk-oEL1Hbzm6wukwplYbFxiDCWpBp7A_aem_chJb9D9JWll4fF-rmoHkMg,204,0.97,14,2026-04-13,0,human
"US appeals court fines lawyers $30,000 in latest AI-related sanction",https://www.reuters.com/legal/litigation/us-appeals-court-fines-lawyers-30000-latest-ai-related-sanction-2026-03-16/,445,0.96,22,2026-03-17,0,human
Ohio firm must pay $22.5 million to mom whose baby died after she was denied work-from-home,https://www.nbcnews.com/news/us-news/ohio-firm-must-pay-225-million-mom-whose-baby-died-was-denied-work-hom-rcna264321?cid=sm_npd_nn_tw_ma&taid=69bc55cb9ac2060001303ea5&utm_campaign=trueanthem&utm_medium=social&utm_source=twitter,28687,0.97,974,2026-03-19,0,human
Syrian authorities ban alcohol in Damascus,https://www.reuters.com/world/middle-east/syrian-authorities-ban-alcohol-damascus-2026-03-17/,704,0.88,236,2026-03-18,0,human
"If you could travel back in time, where would you go?",https://www.reddit.com/r/AskReddit/comments/post_163,42522,0.92,1886,04-06-2026,1,gemini
Iran confirms death of IRGC spokesperson Ali Mohammad Naini in Israeli airstrike in Tehran,https://www.aljazeera.com/news/2026/3/22/iran-confirms-death-irgc-spokesperson-naini-airstrike-tehran,38400,0.88,5400,2026-03-22,1,claude
"Iran disables US radar and sensor networks in region, changes course of war — analysts say",https://multipluralworld.com/world-news-headlines-and-analysis-for-april-2026/,44200,0.87,6800,2026-04-01,1,claude
Amputee cornhole player accused of murder,https://www.fox5dc.com/news/dayton-webber-amputee-cornhole-player-accused-murder?utm_source=fark&utm_medium=website&utm_content=link&utm_campaign=fark&ICID=ref_fark,540,0.89,212,2026-03-23,0,human
AP finds an Israeli group discreetly organized the mystery flights evacuating Palestinians from Gaza,https://apnews.com/article/palestinian-gaza-israel-flights-ad-kan-evacuation-65c9acf46fb65483e866d75636f219a6,5234,0.94,312,2026-03-15,0,human
Brent crude climbs to $102 as blockade takes hold; analysts warn of $120 scenario,https://www.cnbc.com/2026/04/14/brent-crude-102-blockade-analysts-warn-120-scenario.html,24400,0.89,3200,2026-04-14,1,claude
Ancient ruins discovered deep in the Amazon rainforest.,https://www.reddit.com/r/science/comments/post_175,29879,0.92,6859,04-05-2026,1,gemini
Ancient ruins discovered deep in the Amazon rainforest.,https://www.reddit.com/r/science/comments/post_197,42776,0.73,477,04-10-2026,1,gemini
Georgia congressional runoff puts Trump's influence over Republican base to the test,https://www.reuters.com/world/us/georgia-runoff-trump-influence-republican-base-2026-04-08/,19400,0.87,2500,2026-04-08,1,claude
Police in the Bahamas arrest husband of US woman who was aboard boat and vanished,https://apnews.com/article/bahamas-missing-us-woman-husband-boat-overboard-8ae1798fc90e3716796ac76f28c3e92a,9531,0.98,541,2026-04-08,0,human
Pa. county jails earn millions of dollars detaining immigrants for ICE,https://www.spotlightpa.org/news/2026/04/pennsylvania-ice-detention-jails-counties-money-federal-government/,2860,0.97,61,2026-04-11,0,human
BoE's Taylor says rates should be held until war impact on economy is clearer | discussion,https://www.reuters.com/world/uk/boes-taylor-says-rates-should-be-held-until-war-impact-economy-is-clearer-2026-03-26/,4375,0.56,93,2026-03-16,1,chatgpt
Trump sent guns to Iranian protesters through Kurdish militias,https://www.telegraph.co.uk/world-news/2026/04/05/trump-sent-guns-iranian-protesters-through-kurdish-militias/,24642,0.96,1502,2026-04-06,0,human
'Multiple waves' of unauthorized drones recently spotted over strategic US Air Force base,https://abcnews.com/International/multiple-waves-unauthorized-drones-spotted-strategic-us-air/story?id=131245527,7572,0.98,613,2026-03-20,0,human
NASA Artemis II launches in humanity’s first moon mission in more than half a century,https://www.ctvnews.ca/sci-tech/article/artemis-ii-launches-in-humanitys-first-moon-mission-in-more-than-half-a-century/,2548,0.96,271,2026-04-01,0,human
Senate passes major infrastructure bill.,https://www.reddit.com/r/politics/comments/post_24,39106,0.89,2688,04-03-2026,1,gemini
US and Iran agree to two-week ceasefire; Israel continues bombing Lebanon,https://www.democracynow.org/2026/3/3/us-iran-agree-two-week-ceasefire-israel-bombs-lebanon,54200,0.9,7800,2026-03-23,1,claude
Iran's President Pezeshkian publishes open letter to the American people calling for peace,https://multipluralworld.com/world-news-headlines-and-analysis-for-april-2026/,28400,0.91,4100,2026-04-01,1,claude
Graffiti conviction for woman who stuck googly eyes on Blue Blob,https://www.bbc.com/news/articles/cwydx34kzlvo,2966,0.97,322,2026-03-25,0,human
North Korea fires missiles toward sea after ridiculing South's hopes for better ties,https://apnews.com/article/north-korea-launch-south-korea-098ca1f60e71fe6aa25539d8a9e14c96,760,0.95,106,2026-04-07,0,human
‘A moral injury’: City sued over not releasing information on Lower Manhattan air quality danger after 9/11 attack | amNewYork,https://www.amny.com/news/city-sued-not-release-9-11-air-quality-information/,1169,0.97,53,2026-04-01,0,human
"Trump administration seeks Endangered Species Act exemption for oil, gas projects in Gulf",https://apnews.com/article/trump-oil-gas-iran-endangered-species-32484bddd8b28aa3e6ecfd9772429bd9,2753,0.98,89,2026-03-29,0,human
Putin clears firearm usage for private groups to protect Russian energy facilities [live thread],https://www.reuters.com/world/putin-clears-firearm-usage-private-groups-protect-russian-energy-facilities-2026-03-24/,3024,0.79,303,2026-03-28,1,chatgpt
Putin clears firearm usage for private groups to protect Russian energy facilities | discussion,https://www.reuters.com/world/putin-clears-firearm-usage-private-groups-protect-russian-energy-facilities-2026-03-24/,1450,0.93,50,2026-03-20,1,chatgpt
Iran fires cluster munitions at Israel and strikes oil tanker near Dubai,https://www.democracynow.org/2026/3/31/iran-cluster-munitions-israel-oil-tanker-dubai,64200,0.84,10800,2026-03-30,1,claude
"If you could travel back in time, where would you go?",https://www.reddit.com/r/AskReddit/comments/post_122,9187,0.78,1316,03-16-2026,1,gemini
"Italy's Meloni loses justice referendum, early count suggests",https://www.reuters.com/world/europe/exit-polls-suggest-italys-meloni-has-narrowly-lost-justice-referendum-vote-2026-03-23/,95,0.94,1,2026-03-23,0,human
Stock markets in free fall worldwide as US-Iran conflict erupts into open warfare,https://www.cnbc.com/2026/03/26/stock-markets-free-fall-us-iran-conflict-open-warfare.html,148400,0.89,26400,2026-03-26,1,claude
"3,800 workers are on strike at one of the largest meatpacking plants in the US",https://apnews.com/article/meatpacking-plant-strike-jbs-greeley-colorado-02e9d57762af09a609b34d8e577f0c37,13817,0.98,473,2026-03-16,0,human
Airports rush to feed unpaid TSA workers as belts tighten,https://www.reuters.com/business/world-at-work/airports-rush-feed-unpaid-tsa-workers-belts-tighten-2026-03-21/,11891,0.97,939,2026-03-21,0,human
What's the best advice you've ever received?,https://www.reddit.com/r/AskReddit/comments/post_153,7946,0.9,354,04-08-2026,1,gemini
New candidate enters the 2028 presidential race.,https://www.reddit.com/r/politics/comments/post_179,24839,0.83,1177,03-15-2026,1,gemini
Judge Rules Pentagon Restrictions on Press Are Unconstitutional,https://www.nytimes.com/2026/03/20/business/media/pentagon-press-restrictions-new-york-times.html?unlocked_article_code=1.UlA.U4Qd.9sPk18dO3CQK&smid=url-share,11098,0.99,121,2026-03-20,0,human
Soaring fuel prices drive German far-right calls for a turn back to Russia,https://www.reuters.com/business/soaring-fuel-prices-drive-german-far-right-calls-turn-back-russia-2026-03-31/,1214,0.93,221,2026-03-31,0,human
WNBA players unanimously approve new 7-year collective bargaining agreement,https://abcnews.com/Sports/wireStory/wnba-players-unanimously-approve-new-7-year-collective-131329578,942,0.91,125,2026-03-23,0,human
What's a secret you've never told anyone?,https://www.reddit.com/r/AskReddit/comments/post_98,30560,0.95,1199,04-01-2026,1,gemini
BoE's Taylor says rates should be held until war impact on economy is clearer | discussion,https://www.reuters.com/world/uk/boes-taylor-says-rates-should-be-held-until-war-impact-economy-is-clearer-2026-03-26/,2053,0.83,1476,2026-04-08,1,chatgpt
Protests break out in major cities over new tax law.,https://www.reddit.com/r/politics/comments/post_41,58242,0.71,5670,03-26-2026,1,gemini
Stock market reaches all-time high amid economic recovery.,https://www.reddit.com/r/news/comments/post_40,46428,0.76,5963,04-07-2026,1,gemini
"Rory McIlroy wins Masters, first to repeat since Tiger Woods",https://www.espn.com/golf/story/_/id/48469822/rory-mcilroy-wins-masters-first-repeat-tiger-woods,3189,0.95,45,2026-04-12,0,human
US and Iran agree to a two-week ceasefire [live thread],https://apnews.com/live/iran-war-israel-trump-04-07-2026,363,0.85,3,2026-03-31,1,chatgpt
Senate passes major infrastructure bill.,https://www.reddit.com/r/politics/comments/post_66,2527,0.93,76,04-12-2026,1,gemini
Australia fuel crisis deepens as PM calls second emergency national cabinet meeting,https://www.abc.net.au/news/2026-03-26/pm-calls-second-national-cabinet-over-fuel-crisis/106496520,388,0.97,37,2026-03-26,0,human
Artemis II sets new record as astronauts travel farther from Earth than ever before,https://www.theguardian.com/science/2026/apr/06/artemis-ii-astronauts-record-moon-earth-distance,1172,0.95,96,2026-04-06,0,human
US and Iran agree to a two-week ceasefire,https://apnews.com/live/iran-war-israel-trump-04-07-2026,3855,0.61,942,2026-03-26,1,chatgpt
Nasa eyeing next challenge already after successful Artemis II mission,https://www.the-independent.com/space/nasa-artemis-ii-moon-space-b2956191.html,946,0.96,100,2026-04-13,0,human
"U.S. is allowing Iranian oil tankers through Strait of Hormuz, says Bessent",https://www.cnbc.com/2026/03/16/us-is-allowing-iranian-tankers-through-strait-of-hormuz-says-bessent.html,1871,0.93,388,2026-03-16,0,human
Researchers uncover unusual pattern in Arctic sea ice melt,https://www.apnews.com/article/arctic-sea-ice-melt-pattern-2026,4280,0.69,906,2026-03-24,1,chatgpt
