Title,URL,Score,Upvote_Ratio,Num_Comments,Post_Date,target,source_model
"US begins Iran port blockade, oil prices ease on hopes for dialogue",https://www.reuters.com/world/us-begins-iran-port-blockade-oil-prices-2026-04-14/,459,0.64,767,2026-03-28,1,chatgpt
"Years of drought has major energy port of Corpus Christi, Texas, wrestling with water crisis",https://apnews.com/article/corpus-christi-texas-water-shortage-oil-gas-1d9577698f394e83335f1ed5c16cef6d,1594,0.98,82,2026-04-13,0,human
"US FAA probes close call between United jet, Army helicopter in California",https://www.reuters.com/business/aerospace-defense/us-faa-probes-close-call-between-united-jet-army-helicopter-california-2026-03-26/,526,0.95,33,2026-03-26,0,human
Record-breaking heatwave hits the Midwest.,https://www.reddit.com/r/news/comments/post_111,40820,0.9,5838,04-01-2026,1,gemini
"Israeli police attack journalists in Jerusalem, fracturing wrist of CNN producer | CNN",https://edition.cnn.com/2026/03/21/middleeast/israel-police-attack-journalists-cnn-producer-latam-intl,7456,0.95,257,2026-03-21,0,human
Israeli strikes on Iraq oil infrastructure spark Baghdad protest calling for war to stop,https://www.reuters.com/world/middle-east/israeli-strikes-iraq-oil-infrastructure-baghdad-protest-2026-03-19/,38400,0.86,5800,2026-03-19,1,claude
QatarEnergy reports 'extensive damage' after missile attacks on Ras Laffan industrial city,https://www.reuters.com/world/middle-east/qatarenergy-reports-extensive-damage-after-missile-attacks-ras-laffan-industrial-2026-03-18/,1084,0.98,171,2026-03-18,0,human
'Ketamine Queen' Jasveen Sangha jailed for 15 years over death of Matthew Perry,https://news.sky.com/story/ketamine-queen-jasveen-sangha-jailed-for-15-years-over-death-of-matthew-perry-13529344,21526,0.96,1582,2026-04-08,0,human
"US to require $15,000 bond to visa recipients from 12 more countries",https://www.reuters.com/world/americas/us-require-15000-bond-visa-recipients-12-more-countries-2026-03-18/,1401,0.96,181,2026-03-20,0,human
"Iran targets Israel and Gulf Arab states, Israel to expand Lebanon operations | CBC News",https://www.cbc.ca/news/world/iran-israel-war-trump-talks-9.7139660,82,0.87,5,2026-03-24,0,human
Japan begins unilateral oil reserve release amid Iran crisis,https://english.kyodonews.net/articles/-/72336,2247,0.98,123,2026-03-16,0,human
Russia condemns US-Israel war on Iran at UN; China calls for immediate ceasefire,https://apnews.com/article/russia-condemns-us-israel-iran-un-china-ceasefire-2026-04-02,44200,0.88,6400,2026-04-02,1,claude
Satellite firm Planet Labs to indefinitely withhold Iran war images,https://www.reuters.com/business/media-telecom/satellite-firm-planet-labs-indefinitely-withhold-iran-war-images-2026-04-05/,2272,0.96,142,2026-04-05,0,human
Rays RHP Ryan Pepiot (hip) to begin season on IL,https://www.reuters.com/sports/rays-rhp-ryan-pepiot-hip-begin-season-il--flm-2026-03-24/,1071,0.81,536,2026-03-20,1,chatgpt
IDF says failed assassination attempt on Hezbollah operative instead killed opposition official,https://www.reuters.com/world/middle-east/israeli-strike-kills-christian-party-official-lebanon-widening-divisions-over-2026-04-06/,2529,0.96,48,2026-04-06,0,human
"Commander of Iran's paramilitary Basij force killed, Iranian state media says",https://www.reuters.com/world/middle-east/commander-irans-paramilitary-basij-force-killed-iranian-state-media-says-2026-03-17/,160,0.94,13,2026-03-17,0,human
Qatar suspends LNG production after two Iranian drone strikes hit its facilities,https://www.reuters.com/business/energy/qatar-suspends-lng-production-iranian-drone-strikes-2026-03-28/,48200,0.9,7100,2026-03-28,1,claude
"Under siege by a Mexican cartel, these civilians fight back with AK-47s and grenades",https://abcnews.com/International/wireStory/siege-mexican-cartel-now-civilians-fight-back-ak-131243677,1048,0.96,59,2026-03-20,0,human
Rays RHP Ryan Pepiot (hip) to begin season on IL | discussion,https://www.reuters.com/sports/rays-rhp-ryan-pepiot-hip-begin-season-il--flm-2026-03-24/,2174,0.52,1221,2026-03-28,1,chatgpt
New Covid variant has been identified and is already spreading in 25 states,https://www.the-independent.com/news/health/covid-variant-us-travelers-wastewater-b2944619.html,19266,0.9,1671,2026-03-24,0,human
Researchers find potential cure for rare genetic disorder.,https://www.reddit.com/r/science/comments/post_35,52835,0.65,4377,03-30-2026,1,gemini
Putin clears firearm usage for private groups to protect Russian energy facilities (analysis),https://www.reuters.com/world/putin-clears-firearm-usage-private-groups-protect-russian-energy-facilities-2026-03-24/,876,0.86,318,2026-03-23,1,chatgpt
Trump extends pause on striking Iranian energy plants by 10 days and says 'talks are ongoing',https://www.bbc.com/news/live/cre0vl84qy9t,164,0.9,78,2026-03-26,0,human
"If you could travel back in time, where would you go?",https://www.reddit.com/r/AskReddit/comments/post_143,2960,0.75,3001,04-01-2026,1,gemini
Worker sets fire to California paper warehouse in protest: 'All you had to do was pay us enough',https://www.democracynow.org/2026/4/13/worker-fire-california-paper-warehouse-protest-pay,58400,0.9,9400,2026-03-17,1,claude
Scientists discover first evidence of liquid water on an exoplanet.,https://www.sciencedaily.com/releases/exoplanet-water,50067,0.99,5637,04-07-2026,1,gemini
Wildfire smoke causes flight delays across the Midwest (analysis),https://www.apnews.com/article/wildfire-smoke-flight-delays-midwest-2026,1956,0.78,478,2026-04-11,1,chatgpt
Scientists report new coral recovery gains in Pacific reefs,https://www.reuters.com/business/environment/scientists-report-new-coral-recovery-gains-in-pacific-reefs-2026-04-09/,3345,0.66,1372,2026-03-18,1,chatgpt
"Inside the fiery, deadly crashes involving the Tesla Cybertruck",https://www.theguardian.com/technology/2026/mar/18/tesla-cybertruck-crashes-battery-fires,1085,0.94,195,2026-03-18,0,human
"Senate investigation: drugmaker harmed patients, profited, with asthma inhaler switch",https://www.cnn.com/2026/03/16/health/video/gsk-flovent-senate-investigation-tirrell-digvid,603,0.98,22,2026-03-16,0,human
BoE's Taylor says rates should be held until war impact on economy is clearer [explainer],https://www.reuters.com/world/uk/boes-taylor-says-rates-should-be-held-until-war-impact-economy-is-clearer-2026-03-26/,3574,0.8,1047,2026-03-18,1,chatgpt
Report: Warriors G Moses Moody (knee) out rest of season (analysis),https://www.reuters.com/sports/report-warriors-g-moses-moody-knee-out-rest-season--flm-2026-03-24/,1755,0.76,1481,2026-04-13,1,chatgpt
"Red Cross issues emergency appeal for $2 billion in aid to Iran, Lebanon, Gaza",https://apnews.com/article/red-cross-emergency-appeal-2-billion-iran-lebanon-gaza-2026-03-20,44200,0.95,5800,2026-03-20,1,claude
"If you could travel back in time, where would you go?",https://www.reddit.com/r/AskReddit/comments/post_55,49158,0.67,2377,03-18-2026,1,gemini
Report: Packers' Micah Parsons may miss first 3-4 games [live thread],https://www.reuters.com/sports/report-packers-micah-parsons-may-miss-first-3-4-games--flm-2026-03-26/,2808,0.6,1298,2026-04-11,1,chatgpt
Scientists report new coral recovery gains in Pacific reefs [live thread],https://www.reuters.com/business/environment/scientists-report-new-coral-recovery-gains-in-pacific-reefs-2026-04-09/,2291,0.52,758,2026-03-21,1,chatgpt
Pentagon says it will ramp up war supplies with defense companies,https://www.reuters.com/business/aerospace-defense/pentagon-says-it-will-ramp-up-war-supplies-with-defense-companies-2026-03-25/,1423,0.96,166,2026-03-25,0,human
Iran war drives US gas prices to $5.24 average nationally — highest since 2022,https://www.cnbc.com/2026/04/08/iran-war-drives-us-gas-prices-5-24-highest-since-2022.html,68400,0.9,10800,2026-04-08,1,claude
"Brent crude briefly tops $119 per barrel, before receding, and shakes stock markets worldwide",https://www.boston.com/news/business/2026/03/20/brent-crude-briefly-tops-119-per-barrel-before-receding-and-shakes-stock-markets-worldwide/,536,0.95,62,2026-03-20,0,human
"If you could travel back in time, where would you go?",https://www.reddit.com/r/AskReddit/comments/post_81,23847,0.9,1156,03-30-2026,1,gemini
Cuba's President Díaz-Canel tells NBC he will not step down — first US network interview,https://www.npr.org/2026/04/10/nx-s1-5780023/cuba-diaz-canel-nbc-interview-wont-step-down,16300,0.88,1800,2026-04-10,1,claude
"Suspect in Gilgo Beach serial killings expected to plead guilty, sources say",https://www.nbcnews.com/news/us-news/suspect-gilgo-beach-serial-killings-rex-heuermann-expected-guilty-plea-rcna265396,1398,0.97,164,2026-03-26,0,human
Gaza toddler released from Israeli custody with suspected torture wounds,https://news.sky.com/story/gaza-toddler-released-from-israeli-custody-with-suspected-torture-wounds-13525011,15185,0.87,939,2026-03-27,0,human
Record-breaking heatwave hits the Midwest.,https://www.reddit.com/r/news/comments/post_196,50281,0.82,5876,04-06-2026,1,gemini
Google developing options to allow AI opt-out in search to ease UK concerns,https://www.reuters.com/sustainability/boards-policy-regulation/google-allow-ai-opt-out-ease-uk-competition-concerns-2026-03-18/,342,0.95,34,2026-03-18,0,human
Trump warns of 'much more to follow' as US bombs civilian infrastructure in Iran,https://www.democracynow.org/2026/4/3/trump-bombs-civilian-infrastructure-iran-much-more,94200,0.86,16400,2026-04-03,1,claude
Amazon Loses Appeal; South Carolina Supreme Court Rules It Owes State $12.5 Million,https://www.southcarolinapublicradio.org/sc-news/2026-03-19/amazon-loses-appeal-south-carolina-supreme-court-rules-it-owes-state-12-5-million,1001,0.99,22,2026-03-25,0,human
City council approves transit expansion plan after late-night vote [live thread],https://www.apnews.com/article/city-council-transit-expansion-vote-2026,3063,0.87,1104,2026-04-14,1,chatgpt
Senate passes major infrastructure bill.,https://www.reddit.com/r/politics/comments/post_54,46072,0.77,123,04-13-2026,1,gemini
"Middle East conflict may lift inflation by 3.2% in developing Asia and Pacific, says ADB | discussion",https://www.reuters.com/sustainability/boards-policy-regulation/middle-east-conflict-may-lift-inflation-by-32-developing-asia-pacific-says-adb-2026-03-26/,2906,0.89,697,2026-03-23,1,chatgpt
Second Global Sumud Flotilla departs Barcelona for Gaza aiming to break Israeli blockade,https://www.democracynow.org/2026/4/13/second-global-sumud-flotilla-barcelona-gaza-blockade,31200,0.88,4200,2026-04-12,1,claude
Humanitarian aid flights to Iran halted as airspace remains closed to civilian aircraft,https://apnews.com/article/humanitarian-aid-flights-iran-halted-airspace-closed-2026-03-18,44200,0.94,5800,2026-03-18,1,claude
"Communities fight back as tech giants build more than 4,000 AI data centers across the US",https://www.cbsnews.com/news/ai-data-centers-4000-us-communities-fight-back-environment/,44200,0.91,6800,2026-03-29,1,claude
Scientists report new coral recovery gains in Pacific reefs,https://www.reuters.com/business/environment/scientists-report-new-coral-recovery-gains-in-pacific-reefs-2026-04-09/,439,0.57,1152,2026-04-14,1,chatgpt
"Middle East conflict may lift inflation by 3.2% in developing Asia and Pacific, says ADB",https://www.reuters.com/sustainability/boards-policy-regulation/middle-east-conflict-may-lift-inflation-by-32-developing-asia-pacific-says-adb-2026-03-26/,2032,0.63,1436,2026-03-18,1,chatgpt
"If you could travel back in time, where would you go?",https://www.reddit.com/r/AskReddit/comments/post_31,30656,0.78,3203,03-24-2026,1,gemini
Philippines halts all flights to Middle East until April 30 over Iran war safety concerns,https://apnews.com/article/philippines-halts-flights-middle-east-iran-war-safety-2026-03-28,28400,0.92,3800,2026-03-28,1,claude
Thousands gather for No Kings rally in Minnesota,https://kstp.com/kstp-news/top-news/thousands-gather-for-no-kings-rally-in-minnesota/,9236,0.94,342,2026-03-28,0,human
Senate Democrats introduce resolution to end US military operations in Iran within 30 days,https://apnews.com/article/senate-democrats-resolution-end-us-iran-military-operations-2026-04-03,58400,0.91,9200,2026-04-03,1,claude
Scientists report new coral recovery gains in Pacific reefs [live thread],https://www.reuters.com/business/environment/scientists-report-new-coral-recovery-gains-in-pacific-reefs-2026-04-09/,4322,0.93,866,2026-04-14,1,chatgpt
"Israeli foreign minister denies reports of Lebanon talks, interceptor shortages",https://www.reuters.com/world/middle-east/israeli-foreign-minister-says-no-plans-talks-with-lebanese-government-2026-03-15/?taid=69b6c4c815e5590001e267d3&utm_campaign=trueAnthem:+Trending+Content&utm_medium=trueAnthem&utm_source=twitter,118,0.88,2,2026-03-15,0,human
US and Iran peace talks in Islamabad collapse after 14 hours without a deal,https://www.nbcnews.com/world/iran/live-blog/live-updates-us-iran-fail-reach-deal-peace-talks-day-negotiations-rcna315918,44300,0.9,6700,2026-04-12,1,claude
Australia's Fair Work Commission abolishes junior pay rates for young adults.,https://www.abc.net.au/news/2026-03-31/fair-work-comission-junior-pay-rates-retail-fast-food/106514948,607,0.97,17,2026-03-31,0,human
"US bombs major bridge in Karaj, Iran; strikes again an hour later as rescuers assist wounded",https://www.democracynow.org/2026/4/3/us-bombs-karaj-bridge-iran-civilian-infrastructure,88200,0.86,15200,2026-04-03,1,claude
Scientists discover 300-million-year-old fossil once thought to be oldest octopus is actually a nautilus,https://www.cbsnews.com/news/300-million-year-old-fossil-oldest-octopus-nautilus-relative/,84200,0.97,9800,2026-04-09,1,claude
"Kansas revoked driver's licenses of 1,700 transgender residents",https://www.nbcnews.com/news/us-news/kansas-revoked-drivers-licenses-1700-transgender-residents-rcna262120,27296,0.92,2423,2026-03-15,0,human
FCC green-lights Nexstar's $6.2B merger with rival TV station owner Tegna,https://www.nbcnews.com/business/media/fcc-greenlights-nexstars-62b-merger-rival-tv-station-owner-tegna-rcna237953,241,0.91,35,2026-03-20,0,human
Retired matador killed by bull ahead of bullfight in southern Spain,https://www.ctvnews.ca/world/article/retired-matador-killed-by-bull-ahead-of-bullfight-in-southern-spain/,5152,0.97,633,2026-04-05,0,human
"Valerie Perrine, actress and Superman star, dead at 82",https://www.fox13news.com/news/valerie-perrine-actress-superman-star-dead-82,364,0.9,29,2026-03-23,0,human
Universities pressured to strip names of Epstein associates from campus buildings,https://apnews.com/article/epstein-associates-building-names-removal-5acbfd805d623934ccbfd0aca813cdac,7295,0.99,131,2026-04-02,0,human
Report: Warriors G Moses Moody (knee) out rest of season,https://www.reuters.com/sports/report-warriors-g-moses-moody-knee-out-rest-season--flm-2026-03-24/,3255,0.97,1141,2026-03-26,1,chatgpt
"New AI tools reshape customer support jobs, survey finds | discussion",https://www.reuters.com/technology/new-ai-tools-reshape-customer-support-jobs-survey-finds-2026-04-11/,2080,0.73,1365,2026-03-15,1,chatgpt
Cuba’s electrical grid collapses amid US oil blockade | Cuba,https://www.theguardian.com/world/2026/mar/16/cuba-electrical-grid-collapses-amid-us-oil-blockade,3547,0.97,253,2026-03-17,0,human
US-Iran ceasefire talks: What each side is demanding and why they keep failing,https://www.aljazeera.com/news/2026/4/5/us-iran-ceasefire-talks-demands-why-failing-explained,44200,0.91,6200,2026-04-05,1,claude
Exclusive: Trump approved Iran operation after Netanyahu argued for joint killing of Khamenei,https://www.reuters.com/world/middle-east/trump-approved-iran-operation-after-netanyahu-argued-joint-killing-khamenei-2026-03-23/,5873,0.99,192,2026-03-23,0,human
"Epstein victims sue Google, Trump administration for disclosing personal information",https://www.cnbc.com/2026/03/27/jeffrey-epstein-victims-sue-trump-administration-google.html,3693,0.99,48,2026-03-27,0,human
Suspect arrested after North Carolina woman reports she was set on fire at home,https://apnews.com/article/woman-set-on-fire-north-carolina-ac3059ad0a489f1da0e7e31336440d01,310,0.98,6,2026-04-13,0,human
"In search of Banksy, Reuters found the artist took on a new identity",https://www.reuters.com/investigates/special-report/global-art-banksy/,2043,0.9,247,2026-03-16,0,human
"Congo says its mpox outbreak is over after 2 years and more than 2,200 suspected deaths",https://apnews.com/article/mpox-disease-health-congo-africa-outbreak-f1219ae63e5675aa74d1202e21b9035b,491,0.97,9,2026-04-03,0,human
Records shattered as summer heat hits Southwest in March; 'This is what climate change looks like',https://apnews.com/article/heat-southwest-warming-climate-disasters-extreme-deadly-0c3ef415241d3275fd9c260d57ccc3e5?utm_source=copy&utm_medium=share,1331,0.95,96,2026-03-20,0,human
Protests break out in major cities over new tax law.,https://www.reddit.com/r/politics/comments/post_101,15367,0.68,1132,04-14-2026,1,gemini
Nasdaq Composite confirms correction as war worries weigh,https://www.reuters.com/business/nasdaq-composite-confirms-correction-war-worries-weigh-2026-03-26/,937,0.98,50,2026-03-26,0,human
Kimberly-Clark employee detained on suspicion of arson after massive Ontario warehouse fire,https://www.foxla.com/news/ontario-kimberly-clark-warehouse-fire-arson-suspect,912,0.98,119,2026-04-07,0,human
New pancreatic cancer drug doubles survival compared to standard-of-care in late-stage clinical trial,https://www.cnbc.com/2026/04/13/pancreatic-cancer-drug-daraxonrasib-from-revolution-medicines-succeeds-in-trial.html,1081,0.99,29,2026-04-13,0,human
"If you could travel back in time, where would you go?",https://www.reddit.com/r/AskReddit/comments/post_23,45233,0.86,333,04-03-2026,1,gemini
"Middle East conflict may lift inflation by 3.2% in developing Asia and Pacific, says ADB",https://www.reuters.com/sustainability/boards-policy-regulation/middle-east-conflict-may-lift-inflation-by-32-developing-asia-pacific-says-adb-2026-03-26/,3407,0.86,640,2026-03-28,1,chatgpt
German men aged 17-45 may need military approval for long stays abroad,https://www.bbc.com/news/articles/cvg3nr83xyvo,5751,0.94,763,2026-04-04,0,human
"US has caused $10tn worth of climate damage since 1990, research finds",https://www.theguardian.com/environment/2026/mar/25/us-climate-damage-research,5411,0.94,226,2026-03-25,0,human
New candidate enters the 2028 presidential race.,https://www.reddit.com/r/politics/comments/post_178,5953,0.67,4240,04-13-2026,1,gemini
New study links coffee consumption to longevity.,https://www.reddit.com/r/science/comments/post_129,22040,0.66,6897,04-04-2026,1,gemini
Man dies in Mesa police custody Saturday night,https://www.abc15.com/news/region-southeast-valley/mesa/man-dies-in-mesa-police-custody-saturday-night,1957,0.96,75,2026-04-06,0,human
Suburban Detroit school settles lawsuit with Palestinian student over Pledge of Allegiance dispute,https://apnews.com/article/michigan-teen-school-pledge-palestinians-50dd112d76ab03865a34b2a8139ea573,3556,0.94,225,2026-03-28,0,human
Retailers warn of supply chain pressure ahead of summer shopping season [explainer],https://www.reuters.com/business/retail-consumer/retailers-warn-of-supply-chain-pressure-ahead-of-summer-shopping-season-2026-04-08/,3261,0.64,250,2026-04-14,1,chatgpt
Geneva's CERN hails delicate test on transporting antimatter as a scientific success,https://apnews.com/article/cern-antiproton-road-test-switzerland-geneva-17369ec3439bf5263d82ca11f0124895,215,0.95,10,2026-03-24,0,human
New study links coffee consumption to longevity.,https://www.reddit.com/r/science/comments/post_161,2606,0.82,1674,03-27-2026,1,gemini
Jared Kushner Solicits Funds for His Firm While Working as Mideast Envoy,https://www.nytimes.com/2026/03/13/business/jared-kushner-affinity-mideast-funds.html?unlocked_article_code=1.T1A.jeix.cawFchBBDfAa&smid=nytcore-ios-share,2956,0.97,111,2026-03-17,0,human
Oil futures spike to $74 a barrel after news of first US strikes on Iranian soil,https://www.cnbc.com/2026/03/15/oil-futures-spike-us-strikes-iran-soil.html,124200,0.9,21400,2026-03-15,1,claude
Judge tosses racial bias challenge to Boston's elite school admissions policy,https://www.reuters.com/legal/government/judge-tosses-racial-bias-challenge-bostons-elite-school-admissions-policy-2026-03-19/,208,0.9,17,2026-03-19,0,human
New candidate enters the 2028 presidential race.,https://www.reddit.com/r/politics/comments/post_144,47312,0.74,7985,04-06-2026,1,gemini
"Woman rejected for job because ""her car was too old""",https://www.bbc.com/news/articles/c4g7yd202ngo?utm_campaign=YT+Comms+March&utm_medium=bitly&utm_source=YT+Comm,1716,0.91,514,2026-03-17,0,human
What's a secret you've never told anyone?,https://www.reddit.com/r/AskReddit/comments/post_177,10822,0.81,4377,04-07-2026,1,gemini
"Mideast ports under threat, U.S. military set to impose shipping blockade",https://www.ctvnews.ca/world/mideast-conflict/article/iran-threatens-ports-in-mideast-as-us-military-set-to-impose-shipping-blockade/,983,0.95,149,2026-04-13,0,human
Trump signs executive order to pay TSA workers after House rejects funding bill,https://apnews.com/live/tsa-government-shutdown-ice-trump-03-27-2026?utm_source=copy&utm_medium=share,9751,0.97,613,2026-03-27,0,human
Protests break out in major cities over new tax law.,https://www.reddit.com/r/politics/comments/post_57,27148,0.95,821,04-13-2026,1,gemini
Scientists find strongest evidence yet for liquid water ocean beneath Europa's icy crust,https://www.cnbc.com/2026/04/09/scientists-strongest-evidence-liquid-water-europa-icy-crust.html,98200,0.98,13800,2026-04-09,1,claude
What's a secret you've never told anyone?,https://www.reddit.com/r/AskReddit/comments/post_20,18948,0.78,3724,04-09-2026,1,gemini
Maersk halts operations at Oman's Salalah port due to security incident,https://www.reuters.com/world/middle-east/maersk-halts-operations-omans-salalah-port-due-security-incident-2026-03-28/,709,0.98,20,2026-03-28,0,human
Utah woman who wrote book on grief after husband’s death found guilty of murdering him,https://www.theguardian.com/us-news/2026/mar/17/utah-woman-kouri-richins-found-guilty-husband-ntwnfb,7708,0.99,423,2026-03-17,0,human
"US begins Iran port blockade, oil prices ease on hopes for dialogue [explainer]",https://www.reuters.com/world/us-begins-iran-port-blockade-oil-prices-2026-04-14/,4398,0.87,1312,2026-03-25,1,chatgpt
Scientists report new coral recovery gains in Pacific reefs — update,https://www.reuters.com/business/environment/scientists-report-new-coral-recovery-gains-in-pacific-reefs-2026-04-09/,45,0.94,218,2026-04-08,1,chatgpt
White House prepares to request record $1.5 trillion Pentagon budget — largest since WWII,https://www.democracynow.org/2026/4/3/white-house-1-5-trillion-pentagon-budget-record,68400,0.88,11200,2026-04-08,1,claude
Iran grants Japan special passage through Strait of Hormuz as diplomatic exception,https://apnews.com/article/iran-japan-passage-strait-hormuz-diplomatic-exception-2026-03-22,22400,0.91,2900,2026-03-22,1,claude
Protests break out in major cities over new tax law.,https://www.reddit.com/r/politics/comments/post_136,59612,0.87,4262,03-18-2026,1,gemini
Stock market reaches all-time high amid economic recovery.,https://www.reddit.com/r/news/comments/post_187,36866,0.94,5487,03-28-2026,1,gemini
"US regulator bans imports of new foreign-made routers, citing security concerns",https://www.reuters.com/sustainability/boards-policy-regulation/fcc-banning-imports-new-chinese-made-routers-citing-security-concerns-2026-03-23/,1064,0.96,209,2026-03-23,0,human
Poland withdraws forces from Iraq citing regional threat posed by the Iran conflict,https://apnews.com/article/poland-withdraws-forces-iraq-iran-war-threat-2026-04-09,17400,0.87,2200,2026-04-09,1,claude
"Israel to destroy ‘all houses’ near Lebanon border, defence minister says",https://www.ctvnews.ca/world/article/israel-to-destroy-all-houses-near-lebanon-border-defence-minister-says/?taid=69cc095bce3e6b00011e3ab1&utm_campaign=trueAnthem%3A+Trending+Content&utm_medium=trueAnthem&utm_source=twitter,4719,0.95,521,2026-03-31,0,human
Russian oil tanker begins discharging cargo in Cuba's Matanzas terminal,https://www.reuters.com/business/energy/russian-oil-tanker-enters-anchorage-cubas-matanzas-port-ship-data-says-2026-03-31/,477,0.96,40,2026-03-31,0,human
Jared Kushner Solicits Funds for His Firm While Working as Mideast Envoy,https://www.nytimes.com/2026/03/13/business/jared-kushner-affinity-mideast-funds.html?unlocked_article_code=1.TFA.dn9Q.MOAvQUjR2fwm&smid=url-share,6475,0.97,210,2026-03-15,0,human
Ancient ruins discovered deep in the Amazon rainforest.,https://www.reddit.com/r/science/comments/post_167,47491,0.8,5605,04-05-2026,1,gemini
Retailers warn of supply chain pressure ahead of summer shopping season — update,https://www.reuters.com/business/retail-consumer/retailers-warn-of-supply-chain-pressure-ahead-of-summer-shopping-season-2026-04-08/,4899,0.52,884,2026-04-07,1,chatgpt
Trial is ending for doctor accused of trying to kill his wife during a cliff-side hike in Hawaii,https://apnews.com/article/hawaii-doctor-hiking-trial-attempted-murder-0204ff2cb1b1fe746710e321671f4a9f,649,0.95,85,2026-04-07,0,human
"Zelenskiy says Ukraine wants money, technology in return for Middle East drone help",https://www.reuters.com/business/aerospace-defense/zelenskiy-says-ukraine-wants-money-technology-return-middle-east-drone-help-2026-03-15/,2650,0.95,226,2026-03-15,0,human
New study links coffee consumption to longevity.,https://www.reddit.com/r/science/comments/post_85,8589,0.75,7247,03-27-2026,1,gemini
He suddenly couldn’t speak in space. NASA astronaut says his medical scare remains a mystery,https://apnews.com/article/nasa-sick-astronaut-medical-evacuation-cc34793ffb73174f18443f2dd9c6ff2f,3403,0.98,205,2026-03-27,0,human
