Title,URL,Score,Upvote_Ratio,Num_Comments,Post_Date,target,source_model
Ex-funeral home owner faces 20 years in prison after giving families fake ashes,https://apnews.com/article/funeral-home-decomposing-bodies-sentencing-colorado-ecde3b7eaadc405a893187c487debc05,1466,0.98,82,2026-03-16,0,human
Ancient ruins discovered deep in the Amazon rainforest.,https://www.reddit.com/r/science/comments/post_154,61860,0.98,940,04-06-2026,1,gemini
8 states file emergency motion to block Nexstar-Tegna merger after FCC approval,https://www.nbcnews.com/business/media/8-states-file-emergency-motion-block-nexstar-tegna-merger-fcc-approval-rcna264485,7072,0.99,104,2026-03-21,0,human
City council approves transit expansion plan after late-night vote (analysis),https://www.apnews.com/article/city-council-transit-expansion-vote-2026,255,0.53,980,2026-04-11,1,chatgpt
New study links coffee consumption to longevity.,https://www.reddit.com/r/science/comments/post_190,32063,0.74,2841,04-10-2026,1,gemini
Polymarket apologizes for allowing wagers on fate of U.S. pilots downed in Iran,https://www.nbcnews.com/news/us-news/polymarket-apologizes-allowing-wagers-fate-us-pilots-downed-iran-rcna266715,5651,0.94,417,2026-04-05,0,human
India's government cracks down on satirists mocking Prime Minister Modi on social media,https://www.npr.org/2026/04/11/nx-s1-5782112/india-modi-satire-crackdown-free-speech,28900,0.86,4100,2026-04-11,1,claude
Israeli airstrike in southern Lebanon kills 3 journalists covering the war,https://abc7chicago.com/post/israeli-airstrike-lebanon-kills-al-manar-tvs-ali-shoeib-mayadeen-fatima-ftouni-brother-mohammed/18796602/,8702,0.95,288,2026-03-28,0,human
Putin clears firearm usage for private groups to protect Russian energy facilities [explainer],https://www.reuters.com/world/putin-clears-firearm-usage-private-groups-protect-russian-energy-facilities-2026-03-24/,322,0.65,902,2026-03-16,1,chatgpt
"Russia launches over 400 drones at Ukraine in rare daytime attack, air force says",https://www.reuters.com/world/europe/russia-launches-over-400-drones-ukraine-rare-daytime-attack-air-force-says-2026-03-24/,3133,0.8,493,2026-03-30,1,chatgpt
Socialist filmmaker Avi Lewis elected to lead Canada's NDP party,https://www.democracynow.org/2026/3/31/avi-lewis-elected-ndp-leader-canada-socialist,22400,0.9,2900,2026-03-31,1,claude
Iran shuts down internet in four major provinces as war escalates,https://www.reuters.com/world/middle-east/iran-shuts-internet-four-provinces-war-2026-03-18/,84200,0.88,14200,2026-03-18,1,claude
"Epic river migrations of fish rapidly collapsing, UN report finds | Fish",https://www.theguardian.com/environment/2026/mar/24/epic-river-migrations-of-fish-rapidly-collapsing-un-report-finds,393,0.97,23,2026-03-24,0,human
Big money flows into state attorney general races as legal battles shape American politics,https://apnews.com/article/attorney-general-elections-2026-arizona-texas-54d50c21447b6f85137da5e01d4652fa,478,0.97,11,2026-03-21,0,human
"Italy refuses US aircraft use of Sicily base for Middle East operations, source says",https://www.reuters.com/business/aerospace-defense/italy-refuses-us-aircraft-use-sicily-base-middle-east-operations-source-says-2026-03-31/,5323,0.98,199,2026-03-31,0,human
Hershey to resume using chocolate in most products; Reese’s grandson may taste sweet victory,https://www.nbcnews.com/news/us-news/hershey-resume-using-chocolate-products-reeses-grandson-may-taste-swee-rcna266230,17195,0.96,1157,2026-04-01,0,human
"Michigan synagogue attack was Hezbollah-inspired act of terrorism, FBI says",https://www.cnn.com/2026/03/30/us/michigan-synagogue-attack-west-bloomfield-fbi-update,585,0.72,211,2026-03-30,0,human
Oil prices rise as concerns grow over 'fragile' US-Iran ceasefire,https://www.bbc.com/news/articles/cq6j0rnvlzeo,1180,0.96,98,2026-04-09,0,human
Pill vs. shot: cost and convenience are reshaping the booming weight-loss drug market,https://www.reuters.com/business/healthcare-pharmaceuticals/pill-shot-weight-loss-drug-market-2026-04-12/,36500,0.93,4600,2026-04-11,1,claude
"Georgia bans many midwives from practicing. Now, several are suing the state.",https://www.nbcnews.com/health/womens-health/midwives-sue-challenge-state-restrictions-rcna264951,2299,0.97,170,2026-04-02,0,human
"Israel deliberately targeting medical facilities in south Lebanon, say health workers",https://www.theguardian.com/world/2026/mar/21/israel-targeting-medical-facilities-south-lebanon-health-workers,6241,0.89,518,2026-03-21,0,human
Jehovah's Witnesses eases rules on blood transfusions,https://www.bbc.com/news/articles/c62j31539dwo,2887,0.95,514,2026-03-23,0,human
Artemis II astronauts are first humans to see parts of the Moon's far side with the naked eye,https://www.cbsnews.com/news/artemis-ii-astronauts-moon-far-side-naked-eye-first-humans/,87400,0.98,10800,2026-04-11,1,claude
Taiwan announces emergency military reserve activation as Iran war rattles Asia,https://apnews.com/article/taiwan-military-reserve-activation-iran-war-asia-2026-03-27,44200,0.89,6400,2026-03-27,1,claude
"Meta must face youth addiction lawsuit by Massachusetts, court rules",https://www.reuters.com/world/meta-must-face-youth-addiction-lawsuit-by-massachusetts-court-rules-2026-04-10/,1843,0.99,31,2026-04-10,0,human
Thiel's secretive Rome conference draws Church attention,https://www.reuters.com/technology/thiels-secretive-rome-conference-draws-church-attention-2026-03-15/,5739,0.98,258,2026-03-15,0,human
A media-rating company says a Trump agency is threatening its livelihood,https://apnews.com/article/trump-administration-newsguard-media-monitoring-ftc-investigation-291c71ebc2d00020326a56807ffccf5f,506,0.96,8,2026-03-15,0,human
Food pantry network across the Midwest abruptly shuts down,https://www.the-independent.com/news/world/americas/rubys-pantry-closure-midwest-b2951133.html,11279,0.98,450,2026-04-02,0,human
American journalist Shelly Kittleson abducted in Iraq,https://www.al-monitor.com/originals/2026/03/american-journalist-shelly-kittleson-abducted-iraq,2847,0.97,162,2026-03-31,0,human
Estonia and Latvia say territories hit by stray Ukrainian drones,https://www.bbc.com/news/articles/c1eql309n12o,97,0.86,7,2026-03-26,0,human
What's a secret you've never told anyone?,https://www.reddit.com/r/AskReddit/comments/post_182,16549,0.9,5572,04-07-2026,1,gemini
"Israel says it struck 3,500 targets in Lebanon in just one month of renewed conflict",https://www.democracynow.org/2026/4/3/israel-struck-3500-targets-lebanon-one-month,41200,0.85,6400,2026-04-10,1,claude
Board of Immigration Appeals denies Mahmoud Khalil's bid to dismiss deportation case,https://apnews.com/article/mahmoud-khalil-deportation-immigration-appeals-ruling-2026,44100,0.89,6900,2026-04-10,1,claude
"US begins Iran port blockade, oil prices ease on hopes for dialogue (analysis)",https://www.reuters.com/world/us-begins-iran-port-blockade-oil-prices-2026-04-14/,4808,0.78,1351,2026-03-30,1,chatgpt
ASU free speech event canceled allegedly after Erika Kirk objects to it,https://tempelocal.org/tempe-news-feed/tempe-news/asu-free-speech-event-canceled-allegedly-after-erika-kirk-objects-Varw5kZDQO,20743,0.95,679,2026-03-22,0,human
"Middle East conflict may lift inflation by 3.2% in developing Asia and Pacific, says ADB — update",https://www.reuters.com/sustainability/boards-policy-regulation/middle-east-conflict-may-lift-inflation-by-32-developing-asia-pacific-says-adb-2026-03-26/,1728,0.95,1161,2026-04-12,1,chatgpt
"Three people killed in gun clash near Israeli consulate in Istanbul, media says",https://www.reuters.com/world/middle-east/gunfire-heard-near-israeli-consulate-istanbul-reuters-witness-says-2026-04-07/,535,0.93,86,2026-04-07,0,human
Putin clears firearm usage for private groups to protect Russian energy facilities — update,https://www.reuters.com/world/putin-clears-firearm-usage-private-groups-protect-russian-energy-facilities-2026-03-24/,1264,0.54,542,2026-03-25,1,chatgpt
Three men arrested in $1 million Lego heist,https://www.abc12.com/news/crime/three-men-arrested-in-1-million-lego-heist/article_e9bb0adf-92e5-5194-994b-8c21ffc2345c.html,2672,0.98,197,2026-04-10,0,human
Researchers find potential cure for rare genetic disorder.,https://www.reddit.com/r/science/comments/post_93,45908,0.77,2429,03-22-2026,1,gemini
UN official warns millions could face hunger due to Middle East crisis | NHK WORLD-JAPAN News,https://www3.nhk.or.jp/nhkworld/en/news/videos/20260408212536295/,572,0.94,21,2026-04-09,0,human
"The pace of hiring just fell to the lowest since 2011, outside of the pandemic",https://www.cnn.com/2026/03/31/economy/us-jolts-job-openings-layoffs-february,12020,0.98,394,2026-04-02,0,human
"Rebels in Congo used containers to hold journalists in brutal conditions, advocacy group says",https://apnews.com/article/congo-goma-m23-reporters-without-borders-f2c557904c997a40cc4992276c8de7cf,191,0.94,5,2026-03-24,0,human
Researchers find potential cure for rare genetic disorder.,https://www.reddit.com/r/science/comments/post_128,47085,0.76,4301,04-06-2026,1,gemini
Wildfire smoke causes flight delays across the Midwest [live thread],https://www.apnews.com/article/wildfire-smoke-flight-delays-midwest-2026,4594,0.5,154,2026-04-14,1,chatgpt
Several Asian nations intervene in forex markets to prop up currencies amid Iran war,https://www.reuters.com/markets/asia-fx-intervention-iran-war-india-philippines-2026-04-07/,19800,0.89,2400,2026-04-11,1,claude
"France tells US NATO serves Euro-Atlantic security, not Hormuz offensive missions",https://www.reuters.com/world/europe/france-tells-us-nato-serves-euro-atlantic-security-not-hormuz-offensive-missions-2026-04-01/,12683,0.98,581,2026-04-03,0,human
Big change for California small businesses: No more SBA loans for non-citizens,https://apnews.com/article/california-small-business-loans-immigrants-c027eee54defe8699edc41312c300f4b,301,0.88,57,2026-03-31,0,human
World leaders condemn US military action; UN Security Council holds emergency session,https://www.reuters.com/world/un-security-council-emergency-session-us-iran-war-2026-03-15/,148400,0.88,26400,2026-03-15,1,claude
Pennsylvania official who exposed noncitizen voting says threat is exaggerated,https://www.spotlightpa.org/news/2026/04/noncitizen-voter-fraud-pennsylvania-election-integrity-al-schdmidt-elections/,2490,0.98,100,2026-04-10,0,human
"Russia launches over 400 drones at Ukraine in rare daytime attack, air force says",https://www.reuters.com/world/europe/russia-launches-over-400-drones-ukraine-rare-daytime-attack-air-force-says-2026-03-24/,211,0.56,733,2026-04-09,1,chatgpt
City council approves transit expansion plan after late-night vote [explainer],https://www.apnews.com/article/city-council-transit-expansion-vote-2026,2278,0.59,1198,2026-03-28,1,chatgpt
Iran strikes Gulf refineries and warns of escalating attacks as US-Israeli bombings continue,https://www.democracynow.org/2026/4/3/iran-strikes-gulf-refineries-escalating-attacks,72400,0.87,11800,2026-04-03,1,claude
DHS pauses new immigrant warehouse purchases amid review of Noem-era contracts,https://apnews.com/article/mullin-noem-immigration-ice-warehouse-detention-warhouses-0141f54a48a47b1a6753aeaecc1b640b,9623,0.98,255,2026-04-01,0,human
Sarah Ferguson stripped of 'freedom of York' by councillors over Epstein Files,https://news.sky.com/story/sarah-ferguson-stripped-of-freedom-of-york-by-councillors-13524797,6273,0.98,123,2026-03-26,0,human
Dudley nursery admits responsibility for toddler's death,https://www.bbc.com/news/articles/c98kljd25kwo,1355,0.97,89,2026-03-25,0,human
"Open the Strait of Hormuz immediately, or face devastating consequences.",https://www.reddit.com/r/worldnews/comments/hormuz_strait,49771,0.84,7110,03-22-2026,1,gemini
Father urgently searches for donor to help son with rare blood disorder,https://www.nbcmiami.com/news/local/father-urgently-searches-for-donor-to-help-son-with-rare-blood-disorder/3787354/,2187,0.96,112,2026-03-29,0,human
Iranian man and Romanian woman charged for trying to enter UK nuclear naval base,https://news.sky.com/story/iranian-man-and-romanian-woman-charged-for-trying-to-enter-uk-nuclear-naval-base-13522207,850,0.95,67,2026-03-21,0,human
"Trump isn’t immune from civil claims his Jan. 6 rally speech incited riot, judge says",https://apnews.com/article/trump-presidential-immunity-jan-6-capitol-riot-13ce62c37c69a82e5748ce6ba4fc8ebb,9383,0.99,131,2026-04-01,0,human
Walmart digital price labels are coming to every store shelf in U.S. by end of 2026,https://www.cnbc.com/2026/03/21/walmart-digital-price-tags-will-be-in-every-us-store-by-end-of-2026.html,13280,0.96,1812,2026-03-29,0,human
Iran holds the key to reopening global energy markets,https://www.reuters.com/business/energy/iran-holds-key-reopening-global-energy-markets-2026-03-15/,345,0.85,70,2026-03-15,0,human
"Trump administration can't make colleges provide race-related data, judge rules",https://www.reuters.com/world/us/trump-administration-cant-make-colleges-provide-race-related-data-judge-rules-2026-04-04/,3719,0.99,65,2026-04-03,0,human
Israelis had just returned to this northern town after the last war. Now rockets are flying again,https://apnews.com/article/israel-lebanon-hezbollah-rockets-shelters-337bbdd84c5e1ed7bfc4323b5c24ff44?utm_source=copy&utm_medium=share,0,0.33,34,2026-03-18,0,human
New study links coffee consumption to longevity.,https://www.reddit.com/r/science/comments/post_87,58424,0.94,7289,04-07-2026,1,gemini
Israel strikes Lebanese capital's southern suburbs in heaviest bombardment in weeks,https://www.aljazeera.com/news/2026/4/8/israel-strikes-southern-beirut-heaviest-bombardment-weeks,41200,0.84,6100,2026-04-08,1,claude
Iran war has some US water utilities facing a fluoride shortage,https://apnews.com/article/fluoride-teeth-decay-dentist-iran-israel-cavities-cc1127d5278674498fe580be9f88a243,775,0.95,64,2026-04-13,0,human
"Strikes on alleged drug boats kill 5 in eastern Pacific, U.S. military says",https://www.whro.org/2026-04-13/strikes-on-alleged-drug-boats-kill-5-in-eastern-pacific-u-s-military-says,3004,0.97,237,2026-04-13,0,human
Iran vows 'severe consequences' as US airstrikes kill top IRGC general in Tehran,https://www.reuters.com/world/middle-east/iran-vows-severe-consequences-us-airstrikes-irgc-general-tehran-2026-03-15/,248400,0.85,44200,2026-03-15,1,claude
"Job openings slide to 6.9 million in February, another hint of sluggish hiring in America",https://abcnews.com/Business/wireStory/job-openings-slide-69-million-february-hint-sluggish-131577093,1821,0.98,116,2026-03-31,0,human
"New AI tools reshape customer support jobs, survey finds",https://www.reuters.com/technology/new-ai-tools-reshape-customer-support-jobs-survey-finds-2026-04-11/,1814,0.96,88,2026-04-07,1,chatgpt
Gulf sovereign wealth funds begin review of US AI data center investments amid Iran war,https://www.reuters.com/technology/gulf-wealth-funds-review-us-ai-data-center-2026-04-07/,21900,0.9,2800,2026-04-07,1,claude
Wildfire smoke causes flight delays across the Midwest [live thread],https://www.apnews.com/article/wildfire-smoke-flight-delays-midwest-2026,819,0.54,436,2026-03-31,1,chatgpt
"Iranian Nobel laureate Narges Mohammadi suffers suspected heart attack in prison, family says",https://www.abc.net.au/news/2026-04-03/marges-mohammadi-iranian-nobel-laureate-heart-attack/106529226,1524,0.94,95,2026-04-02,0,human
Record-breaking heatwave hits the Midwest.,https://www.reddit.com/r/news/comments/post_130,59335,0.96,7210,03-21-2026,1,gemini
Judge throws prosecutor out of court and orders leaders of NJ’s US Attorney’s office to testify,https://apnews.com/article/new-jersey-justice-department-federal-prosecutors-habba-c6882eeefa9432a349127715f3be7d55,3810,0.98,58,2026-03-18,0,human
"Fire truck in deadly LaGuardia crash lacked equipment needed to trigger warning system, NTSB says",https://www.ctvnews.ca/world/article/fire-truck-in-deadly-laguardia-crash-lacked-equipment-needed-to-trigger-warning-system-ntsb-says/,3892,0.98,356,2026-03-24,0,human
Researchers uncover unusual pattern in Arctic sea ice melt,https://www.apnews.com/article/arctic-sea-ice-melt-pattern-2026,4636,0.88,711,2026-04-01,1,chatgpt
Record-breaking heatwave hits the Midwest.,https://www.reddit.com/r/news/comments/post_158,23670,0.88,5157,04-04-2026,1,gemini
Georgia woman charged with murder after police say she took pills to induce abortion,https://www.theguardian.com/us-news/2026/mar/19/georgia-murder-charges-abortion,8466,0.97,887,2026-03-19,0,human
Air Canada CEO to retire after English-only condolence furor,https://www.dw.com/en/air-canada-ceo-to-retire-after-french-condolence-furor/a-76595769,2135,0.93,666,2026-03-30,0,human
Ancient ruins discovered deep in the Amazon rainforest.,https://www.reddit.com/r/science/comments/post_106,10013,0.69,5123,04-01-2026,1,gemini
"Iran taking steps to prevent anti-establishment protests, Tehran residents tell BBC",https://www.bbc.com/news/articles/clygdwqw5dvo,240,0.71,305,2026-03-16,0,human
Researchers uncover unusual pattern in Arctic sea ice melt (analysis),https://www.apnews.com/article/arctic-sea-ice-melt-pattern-2026,1924,0.83,460,2026-04-09,1,chatgpt
Hegseth has intervened in military promotions for more than a dozen senior officers,https://www.nbcnews.com/politics/national-security/hegseth-intervened-military-promotions-dozen-senior-officers-rcna266062,15515,0.98,474,2026-04-04,0,human
Democrats see opening to win back Latino voters in South Florida as Iran war drags on,https://www.reuters.com/world/us/democrats-win-back-latino-voters-south-florida-2026-04-10/,22100,0.88,3200,2026-04-10,1,claude
California Supreme Court halts GOP sheriff's voter fraud investigation,https://www.nbcnews.com/politics/elections/california-supreme-court-halts-gop-sheriffs-voter-fraud-investigation-rcna267299,4577,0.99,107,2026-04-08,0,human
Ms. Rachel aims to help 'close Dilley' ICE facility after speaking with kids in detention there,https://www.nbcnews.com/news/us-news/ms-rachel-ice-detention-children-immigration-dilley-texas-center-rcna263786,26477,0.95,437,2026-03-21,0,human
US appeals court overturns $16 billion judgment over Argentina energy company nationalization,https://apnews.com/article/argentina-ypf-energy-loretta-preska-kirchner-milei-27fd32dbc2562653e8b971b0deed8f3a,415,0.98,8,2026-03-27,0,human
Judicial misconduct allegations: Florida judge faces ethics charges for making racial insensitive comments,https://www.fox35orlando.com/news/judicial-misconduct-allegations-florida-judge-faces-ethics-charges-making-racial-insensitive-comments,2084,0.98,36,2026-03-29,0,human
Iran's IRGC announces new weapons unveiled in response to US-Israeli strikes,https://apnews.com/article/iran-irgc-new-weapons-response-us-israeli-strikes-2026-03-16,68200,0.86,11200,2026-03-16,1,claude
Stock market reaches all-time high amid economic recovery.,https://www.reddit.com/r/news/comments/post_133,61521,0.75,3319,03-24-2026,1,gemini
Plane lands on I-78 in Lehigh County,https://www.wfmz.com/news/area/lehighvalley/lehigh-county/plane-lands-on-i-78-in-lehigh-county/article_2ee2846c-7200-4c07-afc9-0041bd518099.html,400,0.95,22,2026-04-04,0,human
Teens accused of bombing attempt at Mamdani home openly discussed plans to kill,https://www.theguardian.com/us-news/2026/apr/08/gracie-mansion-bomb-attempt-mamdani,10565,0.97,519,2026-04-08,0,human
Trump fires immigration judges who dismissed deportation cases against student activists,https://www.democracynow.org/2026/4/13/trump-fires-immigration-judges-deportations-student-activists,62400,0.89,9800,2026-04-13,1,claude
Hawaii faces another major flood threat 2 weeks after its worst flooding in 20 years,https://www.cnn.com/2026/04/08/weather/hawaii-flooding-kona-storm-climate,1397,0.98,32,2026-04-08,0,human
JPMorgan's Dimon says he is 'a little optimistic' on Iran conflict,https://www.reuters.com/world/middle-east/jpmorgans-dimon-says-he-is-a-little-optimistic-iran-conflict-2026-03-24/,2006,0.61,209,2026-04-05,1,chatgpt
JPMorgan's Dimon says he is 'a little optimistic' on Iran conflict — update,https://www.reuters.com/world/middle-east/jpmorgans-dimon-says-he-is-a-little-optimistic-iran-conflict-2026-03-24/,3806,0.83,1144,2026-04-03,1,chatgpt
"7 people in the U.S. sickened by E. coli linked to cheese made from raw milk, FDA says",https://www.pbs.org/newshour/health/7-people-in-the-u-s-sickened-by-e-coli-linked-to-cheese-made-from-raw-milk-fda-says,3861,0.98,321,2026-03-17,0,human
We had very good and productive talks with Iran.,https://www.reddit.com/r/news/comments/iran_talks,13221,0.78,5014,04-13-2026,1,gemini
Researchers uncover unusual pattern in Arctic sea ice melt [explainer],https://www.apnews.com/article/arctic-sea-ice-melt-pattern-2026,4553,0.5,391,2026-03-17,1,chatgpt
Trump addresses nation: US will 'finish what needs to be done' in Iran,https://www.cnn.com/2026/03/15/politics/trump-addresses-nation-iran-war-finish,312400,0.86,52400,2026-03-15,1,claude
Russia expels British diplomat over spying allegations,https://bbc.com/news/articles/czx94e7j5jpo,577,0.95,22,2026-03-30,0,human
"Brent hits $116 and Europe gas prices surge after attacks on energy facilities in Qatar, Iran",https://www.cnbc.com/2026/03/19/oil-jumps-iran-strikes-qatar-lng-facility-supply-worries.html,701,0.96,90,2026-03-19,0,human
New candidate enters the 2028 presidential race.,https://www.reddit.com/r/politics/comments/post_16,61406,0.91,1144,04-07-2026,1,gemini
Israeli settlers smash cars and set fires in attacks on Palestinians in the West Bank,https://apnews.com/article/israel-palestinians-west-bank-settlers-9ded87da79b032cff60ddd8797846f0e,6307,0.92,485,2026-03-22,0,human
Record-breaking heatwave hits the Midwest.,https://www.reddit.com/r/news/comments/post_118,10311,0.99,6255,03-29-2026,1,gemini
Report: Warriors G Moses Moody (knee) out rest of season (analysis),https://www.reuters.com/sports/report-warriors-g-moses-moody-knee-out-rest-season--flm-2026-03-24/,3023,0.73,1087,2026-03-26,1,chatgpt
New study links coffee consumption to longevity.,https://www.reddit.com/r/science/comments/post_56,52789,0.75,999,03-30-2026,1,gemini
Human skull discovered during Easter egg hunt in California,https://www.nbcnews.com/news/us-news/human-skull-discovered-easter-egg-hunt-california-rcna266998,3793,0.98,257,2026-04-06,0,human
Stock market reaches all-time high amid economic recovery.,https://www.reddit.com/r/news/comments/post_149,32733,0.69,763,03-18-2026,1,gemini
Full network of clitoral nerves mapped out for first time | Women's health,https://www.theguardian.com/society/2026/mar/29/full-network-clitoral-nerves-mapped-out-first-time-women-pelvic-surgery,23441,0.95,870,2026-03-29,0,human
Senate passes major infrastructure bill.,https://www.reddit.com/r/politics/comments/post_173,34901,0.75,5695,03-30-2026,1,gemini
"Cuba's national electric grid collapses, leaving millions without power",https://www.reuters.com/business/energy/cubas-national-electric-grid-collapses-says-grid-operator-2026-03-16/,1302,0.97,191,2026-03-17,0,human
Stock market reaches all-time high amid economic recovery.,https://www.reddit.com/r/news/comments/post_79,16861,0.68,1637,03-25-2026,1,gemini
Wildfire smoke causes flight delays across the Midwest,https://www.apnews.com/article/wildfire-smoke-flight-delays-midwest-2026,2187,0.77,589,2026-03-29,1,chatgpt
Stock market reaches all-time high amid economic recovery.,https://www.reddit.com/r/news/comments/post_116,26815,0.98,3301,03-21-2026,1,gemini
US consumer prices surge as expected in March,https://www.reuters.com/world/middle-east/us-consumer-prices-surge-expected-march-2026-04-10/,8686,0.98,528,2026-04-10,0,human
Heavy metal memorabilia on offer at Julien's 'Music Icons' auction | discussion,https://www.reuters.com/business/media-telecom/heavy-metal-memorabilia-offer-juliens-music-icons-auction-2026-03-24/,2354,0.99,185,2026-03-28,1,chatgpt
"American held captive in Afghanistan released, Taliban says",https://abcnews.com/International/american-held-captive-afghanistan-released-taliban/story?id=131355452,170,0.9,13,2026-03-24,0,human
Brent crude nears $100 a barrel as oil markets price in prolonged Hormuz disruption,https://www.reuters.com/markets/commodities/brent-crude-100-barrel-hormuz-disruption-2026-04-10/,29400,0.9,3800,2026-04-10,1,claude
North Korea tests ballistic missiles with cluster-bomb warheads in new weapons spree,https://apnews.com/article/north-korea-missile-cluster-bomb-warhead-test-2026,21000,0.87,2800,2026-04-09,1,claude
MSF report: Rape and sexual violence have become 'part of everyday life' in Sudan's Darfur region,https://www.democracynow.org/2026/3/31/msf-rape-sexual-violence-everyday-life-sudan-darfur,41200,0.93,5800,2026-03-30,1,claude
Wildfire smoke causes flight delays across the Midwest [live thread],https://www.apnews.com/article/wildfire-smoke-flight-delays-midwest-2026,3100,0.54,600,2026-04-10,1,chatgpt
US inflation ticks up to 4.2% in March as oil shock and tariffs ripple through economy,https://apnews.com/article/us-inflation-4-2-march-oil-shock-tariffs-economy-2026-04-06,48200,0.9,7200,2026-04-06,1,claude
Rays RHP Ryan Pepiot (hip) to begin season on IL (analysis),https://www.reuters.com/sports/rays-rhp-ryan-pepiot-hip-begin-season-il--flm-2026-03-24/,709,0.64,923,2026-03-22,1,chatgpt
"New AI tools reshape customer support jobs, survey finds (analysis)",https://www.reuters.com/technology/new-ai-tools-reshape-customer-support-jobs-survey-finds-2026-04-11/,738,0.95,669,2026-04-07,1,chatgpt
"Shock as dozens of bodies, mostly infants, discovered in Kenya mass grave",https://bbc.com/news/articles/clydj9gj24jo,1009,0.97,33,2026-03-25,0,human
Bank of America reaches tentative settlement over Epstein-linked transactions lawsuit,https://www.abc.net.au/news/2026-03-18/bank-of-america-reaches-tentative-settlement-epstein-lawsuit/106467508,343,0.95,12,2026-03-18,0,human
